date,user_id,location,tweet
2016-06-07,1612053474,"Washington, DC",So the first time I voted for a Presidential election was back in…  https://www.instagram.com/p/BGXyDAei6u_RNzvtBcnDYA5R7O8DlKSivbBY2Y0/ …
2016-06-07,464909482,"LosAngeles, CA","I turned 18 three weeks before a general election.  I couldn't wait to #vote.  Ever since, I…  https://www.instagram.com/p/BGXsAvLvMsR/ "
2016-06-07,1865454661,"SouthPole, Antarctica",I #voted and all I got was this stupid sticker #democracy #election @ Hollywood  https://www.instagram.com/p/BGXp1jbm3Sr/ 
2016-06-07,308728277,"WestlakeVillage, CA","Happy Primary Election Day! Don't forget to vote, every vote counts.<Emoji: Victory hand (medium light skin tone)><Emoji: Heavy red heart><Emoji: Flag of United States>#SachsMarketingGroup…  https://www.instagram.com/p/BGXpRGCDZqU/ "
2016-06-07,564061900,"SantaMonica, CA","Rocking my red, white and blue today for Election Day! #Decision2016 #rockthevote #voting…  https://www.instagram.com/p/BGXodfxQx6B/ "
2016-06-07,37037152,LosAngeles,"Post election party. Birria, carnitas & costillas. Oh my. #realmexicanfood #californiavotes @…  https://www.instagram.com/p/BGXlUXSSU6s/ "
2016-06-07,36514716,"LosAngeles, CA",It's Election Day people of California – which really means free pizza in newsrooms everywhere.…  https://www.instagram.com/p/BGXjHD7jPMv/ 
2016-06-07,2465002392,LosAngeles,With the Election going down NOT a political person Ill let the higher powers of the #universe…  https://www.instagram.com/p/BGXhxrajZSv/ 
2016-06-07,46244750,LosAngeles,First time voting! This election's to important to miss @ UCLA  https://www.instagram.com/p/BGXhhOpjKmRBqJWcX_FigPE6Nj65tllCPj3WCk0/ …
2016-06-07,54352166,LosAngeles,The election struggle is real. Just get out there and #Vote#BernieSanders #HillaryClinton…  https://www.instagram.com/p/BGXf-jotnbp/ 
2016-06-07,233889281,"LosAngeles, CA",#actorslife #superstarlife #governor #election #trivia #election2016 #vote #govote #votetoday…  https://www.instagram.com/p/BGXdmwyRwib/ 
2016-06-07,1876745468,"LosAngeles, CA",I voted! #vote #primary #ca #election @ Plummer Park  https://www.instagram.com/p/BGXb7xxwLRO/ 
2016-06-07,2391922964,"LosAngeles, CA",Get out and vote California!!!! Every vote matters in this election! #vote #democracy…  https://www.instagram.com/p/BGXax9uSVsD/ 
2016-06-07,22736051,"LosAngeles, California",Election Day in the Valley. I'm still recovering but I wanted to get out of the house so I could…  https://www.instagram.com/p/BGXZG-xJWwl/ 
2016-06-07,25245954,"WestHollywood, CA",Performing my civic duty and all that. Get out there and do it! #ivoted #california #election…  https://www.instagram.com/p/BGXX4KpOwgS/ 
2016-06-07,42332363,LosAngeles,VOTE<Emoji: Flower playing cards><Emoji: Radio button>#vote #cali #Tuesday #primary #election #usa #bernie #feelthebern #birdiesanders…  https://www.instagram.com/p/BGXXcmtxELk/ 
2016-06-07,524016805,"LosAngeles, CA","Happy Election Day, California! #electionday #america #vote #primaries #california #losangeles…  https://www.instagram.com/p/BGXWSqitGot/ "
2016-06-07,18312048,"Hollywood, CA",Election time!! #CA #Primaries #Hillary #Senate #Sanchez #Judiciary #LosAngeles #Amurica…  https://www.instagram.com/p/BGXVYshM4BD/ 
2016-06-07,25756286,"LosAngeles, CA","SPOTTED: Little J at her local polling place, because today is Election Day. If she can get out…  https://www.instagram.com/p/BGXMOBOGhi_/ "
2016-06-07,93777871,"HuntingtonPark, Ca",Today I going to vote. In the Democratic Primary Election. Go out and go vote. <Emoji: Smiling face with open mouth> @ Huntington…  https://www.instagram.com/p/BGXGmfClMal/ 
2016-06-07,20798466,"LosAngeles, CA",For #losangeles #election2016 #election #progressive #voters #voting #list #guide #la…  https://www.instagram.com/p/BGXGSVZLDxj/ 
2016-06-07,25173083,LosAngeles,"Hello, California! Today is the primary election - if you're a registered voter and haven't…  https://www.instagram.com/p/BGXDVxoMYdc/ "
2016-06-07,51506716,LosAngeles,Today I exercised my American given right to pretend I have a voice. #election2016 #election…  https://www.instagram.com/p/BGXDIHAK1-x/ 
2016-06-07,326197608,"LosAngeles, CA",Happy Election Day.  Here's how I feel. @ South Park Studios  https://www.instagram.com/p/BGW_uKqn3a-/ 
2016-06-07,176245072,"Torrance, CA",Go make a difference!  #election @ Normandie Recreational Center  https://www.instagram.com/p/BGW_KQ7Bj7v/ 
2016-06-07,462450413,LosAngeles,"VOTED! Never has my vote, my voice mattered this much to me in a presidential election. Obama's…  https://www.instagram.com/p/BGW-uwetWCk/ "
2016-06-07,21372186,"LosAngeles, CA","Today's the day, California! Let's VOTE! Does anyone else get shamelessly excited on Election…  https://www.instagram.com/p/BGW-cH2H-hh/ "
2016-06-07,15825515,"LosAngeles, CA",Cardigans for Liberal Democracy! #vote <Emoji: Flag of United States> #primary #election #democracy #2016 #bernie #hillary…  https://www.instagram.com/p/BGW9mcGh9Vc/ 
2016-06-07,46045638,LosAngeles,Even Piglette exercised her civic duty  #ivoted #yovote #election #2016 #primary #polling…  https://www.instagram.com/p/BGW8y2TkH1o/ 
2016-06-07,16339693,LosAngeles|VenturaCounty,"Getting after it on Election Day! #TCB (at @CaddyMarketing and Communications, Inc. in Camarillo, CA) https://www.swarmapp.com/c/egnPtv9t1tK "
2016-06-07,23998049,"iPhone:34.041260, -118.264832","Civic duty calls. It's Election Day, California Primary. Just do it! @ Zoe Christian…  https://www.instagram.com/p/BGW8T59Bd8B/ "
2016-06-07,165784311,"LosAngeles, CA","You guys, I voted in my first California Presidential Primary Election today. Don't forget to…  https://www.instagram.com/p/BGW4TuBJrHM/ "
2016-06-07,633075865,"LosAngeles, CA",HAPPY ELECTION DAY CALIFORNIA!! #electionday #primaries2016 #california #rockthevote…  https://www.instagram.com/p/BGW4UJ9B1EN/ 
2016-06-07,2367969800,"NorthHollywood, LosAngeles",Come thruu #California and #Vote #Letsvote #election #primaries2016 #californiaprimary @ North…  https://www.instagram.com/p/BGW1n4dnCGN/ 
2016-06-07,42362728,"LosAngeles, CA","#Election #Primary #Voted (@ St. Joseph Korean Catholic Center in Winnetka, CA)  https://www.swarmapp.com/c/9nC2x81LMMy "
2016-06-07,319724018,downtownlosangeles,Pretty excited for Election Day!  #votela #turnupthevote @ Downtown Los Angeles  https://www.instagram.com/p/BGWzo9QS5zF/ 
2016-06-07,337987601,"34.083685, -118.311258",Election Day!!!! (@ Crescent Heights Elementary)  https://www.swarmapp.com/c/9Dmh2MHGmTv 
2016-06-07,55218049,LosAngeles,Happy Primary Day! Here are our endorsements for the June 7 election  http://lat.ms/20ZhD0z 
2016-06-07,3827658925,"California, USA",Leimert park never looked so good! #election #communityfirst #results #history #education…  https://www.instagram.com/p/BGWL6GQyFqS/ 
2016-06-07,3827658925,"California, USA",Election time has come California! Let's show up in large numbers & elect the next leader of the…  https://www.instagram.com/p/BGWLoh4yFp3/ 
2016-06-07,26188597,WestHollywood,"Week 4, Day 1 - The Artist's Way Tomorrow is the California primary election, figuring out my…  https://www.instagram.com/p/BGWKlKGxuIx/ "
2016-06-06,240798365,"LA, CA",#widdledonnydwumpf #widdledonny 6•7•16 Election/Birthday Special! Share the cake! #vote #99v1 #JeSuisCharlie pic.twitter.com/10OeWLXGv0
2016-06-06,221664762,NYC|LosAngeles,#BernieSanders2016 #feelthebern #Election #CAVoting #election2016 @ Johnie's Coffee Shop  https://www.instagram.com/p/BGV3YBbkfT4/ 
2016-06-06,297001561,"LosAngeles, CA",Time to cram for tomorrow's test. Exercise your right. Don't forget to VOTE! #election…  https://www.instagram.com/p/BGVz_qAuZBn/ 
2016-06-06,39834969,LosAngeles,@BernieSanders Grande roughlysktch @berniesanders <Emoji: Person raising both hands in celebration (medium skin tone)>#berniesanders #democrat #election #feelthebern #sanders…  https://www.instagram.com/p/BGVNt42o5yr/ 
2016-06-06,2268822906,"LosAngeles, California, USA",So this happened today in 'Murica'. #vote #primaries #murica #election #california #LA #…  https://www.instagram.com/p/BGUwxf9Fx_T/ 
2016-06-06,15588971,"LosAngeles, CA","Wait, tomorrow is Election Day? I never would have known! Heh. Thanks, Mr. President! #imwithher…  https://www.instagram.com/p/BGUZvRERrZ9/ "
2016-06-05,25578574,CA/NY/Space,Get out and vote in your neighborhood election. We did. Thank you @giantroboteric for the ballot…  https://www.instagram.com/p/BGSLyO5tW-f/ 
2016-06-03,8558882,Αθήνα,Ad of the Day: How MTV Is Telling Millennials to Vote in This Craziest of Election Years  http://dlvr.it/LT9yWP  pic.twitter.com/kYNEedwfkO
2016-06-02,274356587,LosAngeles,Bernie's Coffee Shop gets it. Proud to support the ONLY choice in 2016 Election…  https://www.instagram.com/p/BGLDdvBwTGq/ 
2016-06-02,55218049,LosAngeles,Obama gives an election preview of his role as Trump attacker  http://lat.ms/24jwVxS 
2016-06-01,26444809,"LosAngeles, CA","Election training class (@ Holman United Methodist Church in Los Angeles, CA)  https://www.swarmapp.com/c/dOXV8ccvipX "
2016-05-29,17996339,"Chatsworth, CA",2016 election is so weird. https://twitter.com/MattWalshBlog/status/737032713270493184 …
2016-05-29,417579210,"LongBeach, CA","This household just voted by mail! Get 'er done by 6/7, CA! <Emoji: Flexed biceps (medium light skin tone)><Emoji: Smiling face with smiling eyes> #vote #sunday #cali #election…  https://www.instagram.com/p/BF_54J4kRkq/ "
2016-05-29,2275955754,UK,Lamb of God's Randy Blythe: 'The Election Is Looking Pretty Grim'  http://j.mp/24eWSi9  pic.twitter.com/o9XeRzUJAG
2016-05-26,16923506,"Chicago, IL",Celebratory Sundae celebrating Morgan's election Victory! (@ Fair Oaks Pharmacy and Soda Fountain)  https://www.swarmapp.com/c/10XF7LITH4A 
2016-05-24,39880314,"WestHollywood, CA",Nibbles & primary election mail in ballot fill out <Emoji: Flag of United States> @ Scrumptious Cafe & Bakery  https://www.instagram.com/p/BFzh-06NtTK/ 
2016-05-24,55218049,LosAngeles,Analysis: California's seeing a surge in voter registration – but the impact on the June election isn't clear  http://lat.ms/1XQEQTB 
2016-05-23,55218049,LosAngeles,Bernie Sanders supporters sue to have California's voter registration extended until election day  http://lat.ms/1qD32v3 
2016-05-22,55218049,LosAngeles,Bernie Sanders supporters sue to have California's voter registration extended until election day  http://lat.ms/1qD32v3 
2016-05-22,1244448006,"LosAngeles, CA",So far who caught my attention in actaully paying attention to the presidential election was @realDonaldTrump  he makes it like not boring
2016-05-22,2275955754,UK,Dee Snider on Presidential Election: 'I Think the Situation Is Generally Awful'  http://j.mp/27NGdXm  pic.twitter.com/SQmPPgIuQ9
2016-05-21,17220791,"LosAngeles, CA","Election Day is here <Emoji: Flag of United States><Emoji: Thumbs up sign (medium skin tone)>, head to Ramona Hall and vote for arroyoseconc 10a - 2p…  https://www.instagram.com/p/BFrIqjOnp7-/ "
2016-05-20,343410265,"Riverside, CA","Day 94: It's over 2 weeks until the California Primary Election, but I vote early by mail. It's…  https://www.instagram.com/p/BFp-Im3t2Ls/ "
2016-05-19,16874244,"LosAngeles, CA","Extraordinary evening ""Predicting the 2016 Election Event."" @ United Talent Agency  https://www.instagram.com/p/BFnScdxwQK-/ "
2016-05-18,2275955754,UK,"Hatebreed's Jamey Jasta on Politics, 2016 Election + Smashing Racism  http://j.mp/1szj37i  pic.twitter.com/SUsa62RiyH"
2016-05-17,3386578797,"LosAngeles, CA",This election isn't over yet; California's still got something to say.The Bern was…  https://www.instagram.com/p/BFiUL-GvrWN/ 
2016-05-15,342930174,"GranadaHills, CA91344",Election 2016: Negative gearing scare campaign self-serving: Labor  http://dlvr.it/LK9GSm  #Granada Hills
2016-05-15,342886089,"GranadaHills, CA91344",Election 2016: Negative gearing scare campaign self-serving: Labor  http://dlvr.it/LK9GQW 
2016-05-15,29576941,LatinAmerica&U.S.,"So much at stake in this election, why not dumbed down with a Bud Light and a fake Latino…  https://www.instagram.com/p/BFb81oDuKBt/ "
2016-05-13,342930174,"GranadaHills, CA91344",First election debate: Turnbull rushes to defence of real estate agents and bankers  http://dlvr.it/LJJGDh  #Granada Hills
2016-05-13,342886089,"GranadaHills, CA91344",First election debate: Turnbull rushes to defence of real estate agents and bankers  http://dlvr.it/LJJG89 
2016-05-12,14221191,"LosAngeles, CA",#elections2016 #election #elections #hillaryclinton #bernie2016 #berniesanders #clinton2016…  https://www.instagram.com/p/BFUF8vKo2W_/ 
2016-05-12,3163001474,Califas," https://m.youtube.com/watch?v=gdJ7Ad15WCAGods … Judgement! Allowed""Corruption Sodomite America"" By Election of Imposter""I Was In Lock Down/on False Charges!2012"
2016-05-12,8558882,Αθήνα,"Created for Election Season, This Website Lets You Vote for Your Favorite Political Memes  http://dlvr.it/LHq3Rv  pic.twitter.com/jmSRvRoHBX"
2016-05-11,20622474,"Oakland/LosAngeles, CA","This remind me of this years election <Emoji: Loudly crying face> @ Burbank, California  https://www.instagram.com/p/BFSohvRL9e-/ "
2016-05-11,458665333,"LosAngeles, CA","It's election season!Lawn signs, flyers, and vote-by-mail ballots... pic.twitter.com/n1BNsJIoOs"
2016-05-10,2151038539,"AlumniAffairs, UCLA","Special Event Today! Mike de La Rocha '00 is moderating a conversation on the 2016 election,…  https://www.instagram.com/p/BFPNeKmKmDQ/ "
2016-05-10,2151038539,"AlumniAffairs, UCLA","Special Event Today! Mike de La Rocha '00 is moderating a conversation on the 2016 election,…  https://www.instagram.com/p/BFPM6caHd--/ "
2016-05-10,55218049,LosAngeles,Manny Pacquiao poised to win Philippines Senate election  http://lat.ms/1TyZphwm 
2016-05-09,75968594,"Burbank, CA",The election happening in the Philippines is still a JOKE for me. Corruption is still happening.
2016-05-09,3163001474,Califas,"@RealDonalTrump there Is No President Election Gonna Happen Its All A Scam""2016 Not Even Nov Elections Rev5-6 I Don't Lie!!!!"
2016-05-09,125226492,"LongBeach, CA",While waiting for Philippine Election results...Im preparing food for the week my own version of…  https://www.instagram.com/p/BFMtVIeuv-R/ 
2016-05-09,3163001474,Califas,"@RealDonalTrump Gospel Truth"" My Beloved Their is Attempt Hit on Your Life "" Be4 Nov Election"" Rev5-6 These Are Sycopaths Satanic Gov666"""
2016-05-08,27341969,"Lakerswood, Lakersfornia","Hoping for a very peaceful and honest election!! #duterteforpresident2016 @ Los Angeles, California  https://www.instagram.com/p/BFKrN1uqD8r/ "
2016-05-06,55218049,LosAngeles,Donald Trump to testify in Trump University fraud lawsuit -- after the election  http://lat.ms/271eoKO 
2016-05-06,17979038,RadioFreeCalifornia,"Not this year.Not this election season.Consider it consequences for being a know-it-all, pompous, self-important, aging white blowhard."
2016-05-06,215878261,"SantaMonica, CA","""We are in really serious times. This is not entertainment. This is not a reality show."" #POTUS answering question on #2016race #election"
2016-05-04,55218049,LosAngeles,NeverTrump Republicans need to face it: Trump could actually win the general election  http://lat.ms/1rkyMFU 
2016-05-04,1339731,,"SO many awesome choices! #Election #POTUS #Who @ Studio City, California  https://www.instagram.com/p/BE_5YDSm4-c/ "
2016-05-03,32803038,L.A.,#thatsright #feelthebern This election really matters. #vote @ Bernie 2016 Los Angeles Headquarters  https://www.instagram.com/p/BE-J6g1l5bP/ 
2016-05-03,2160736098,LosAngeles,"Does EVERY journalist HAVE to parrot ""pivot to the election"", ""at the end of the day"", etc. Your vocubulary is shrinking to tiny Trump size."
2016-05-03,878304002,,Art imitates election malaise. #glennligon #doubleamerica2 #thebroadmuseum @ The Broad  https://www.instagram.com/p/BE93IgbvgmJ/ 
2016-05-02,48029347,Chicago,"""For your Emmy consideration."" The real election contest in #Hollywood #TV #theamericans #fx…  https://www.instagram.com/p/BE7TZRPtDEp/ "
2016-04-30,14872161,LosAngeles,"#pollworkers #volunteer #vote #clerk Election Date : June 7, 2016 Polls open 7 AM Polls Open 8…  https://www.instagram.com/p/BE2M1oQQn5d/ "
2016-04-28,17077313,SouthernCalifornia,"@realDonaldTrump We told you @realdonaldtrump might come on, but he's looking a little thin. #kfi #news #election…  https://www.instagram.com/p/BEw2j8bJzEq/ "
2016-04-28,55218049,LosAngeles,A Trump-Clinton general election poses a pressing question: Which one does America hate less?  http://lat.ms/1QB6vQr 
2016-04-27,17448463,"Toronto, Ontario","No #Trump Anytime #uspoli #donaldtrump #potus #election @ Los Angeles, California  https://www.instagram.com/p/BEu6H0sNODx/ "
2016-04-27,55218049,LosAngeles,A Trump-Clinton general election poses a question: Which one does America hate less?  http://lat.ms/1QB6vQr 
2016-04-27,55218049,LosAngeles,A Trump-Clinton general election poses a question: Which one does America hate less? Analysis from Cathleen Decker  http://lat.ms/1QB6vQr 
2016-04-27,1393542794,"CanogaPark, LosAngeles","When it comes to election season, Kopi is the only one worth voting for. #NHL17Kopitar #LAKings"
2016-04-26,55218049,LosAngeles,"Just in time for the election season, the U.S. Supreme Court strengthens free-speech rights of public employees  http://lat.ms/24hNcVS "
2016-04-25,34668097,"LosAngeles, CA",Who are you #voting for this #election? Thank you MM for the invite!#shoemmyfyc #raydonovan…  https://www.instagram.com/p/BEpjm-QR5DJ/ 
2016-04-25,71189413,"Valencia, CA","""I've never lost an election and we're not going to lose this one""- Joan W. MacGregor current…  https://www.instagram.com/p/BEpWDBMwxN_/ "
2016-04-22,261819098,Hollywood,#election #president #BernieSanders #HillaryClinton #DonaldTrump #Sanders #Clinton #Trump https://www.facebook.com/events/830622550399751/ … pic.twitter.com/Ls7n5r0EL6
2016-04-22,261819098,Hollywood,#election #president #BernieSanders #HillaryClinton #DonaldTrump #Sanders #Clinton #Trump http://goo.gl/bF81qT  pic.twitter.com/nNyDrhDNwy
2016-04-22,261819098,Hollywood,#election #president #BernieSanders #HillaryClinton #DonaldTrump #Sanders #Clinton #Trump http://goo.gl/U2Rn7H  pic.twitter.com/vxe7wI32tC
2016-04-22,261819098,Hollywood,#election #president #BernieSanders #HillaryClinton #DonaldTrump #Sanders #Clinton #Trump http://goo.gl/YloEyr  pic.twitter.com/3MPmVNHZ8q
2016-04-22,261819098,Hollywood,#election #president #BernieSanders #HillaryClinton #DonaldTrump #Sanders #Clinton #Trump http://usuncut.com/politics/new-york-attorney-general-primary/ … pic.twitter.com/UuJa6Rhh7L
2016-04-22,261819098,Hollywood,#election #president #BernieSanders #HillaryClinton #DonaldTrump #Sanders #Clinton #Trump http://www.alternet.org/election-2016/hillary-and-trumps-crushing-new-york-victories-proved-one-thing-system-shreds … pic.twitter.com/JyxRzhPmHn
2016-04-22,261819098,Hollywood,#election #president #BernieSanders #HillaryClinton #DonaldTrump #Sanders #Clinton #Trump http://nbcnews.to/1Vjnqij  pic.twitter.com/bQFtNo2fGW
2016-04-22,261819098,Hollywood,#election #president #BernieSanders #HillaryClinton #DonaldTrump #Sanders #Clinton #Trump http://thehill.com/blogs/ballot-box/presidential-races/276936-sanders-wins-majority-of-ny-counties-despite-clinton … pic.twitter.com/9w261XsObz
2016-04-22,261819098,Hollywood,#election #president #BernieSanders #HillaryClinton #DonaldTrump #Sanders #Clinton #Trump http://movement4bernie.org/run-all-the-way  pic.twitter.com/az493eOyc0
2016-04-20,353496274,"LosAngeles, CA",#Hillary#vote#election#she#is#the#best#hollywoodhills#losangeles#igers#instagood#everyone#dedicat…  https://www.instagram.com/p/BEcgV4IyJmN/ 
2016-04-20,353496274,"LosAngeles, CA",#Hillary#vote#election#freedom#she#is#the#best#hollywoodhills#losangeles#igers#instagood#everyone…  https://www.instagram.com/p/BEcgRIUyJmE/ 
2016-04-19,90672858,公为下天,lol i just can't with people whose seemingly sole engagement with politics is the presidential election
2016-04-18,240798365,"LA, CA","If the #GOP wants election about the Supreme Court, then the #DNC should make it about the Supreme Court. That's your ticket. #dncplan?2"
2016-04-11,261819098,Hollywood,#election #president #BernieSanders #HillaryClinton #DonaldTrump #Sanders #Clinton #Trump http://goo.gl/xdiAvr  pic.twitter.com/hBABQq0fiO
2016-04-11,261819098,Hollywood,#election #president #BernieSanders #HillaryClinton #DonaldTrump #Sanders #Clinton #Trump http://goo.gl/okprIk  pic.twitter.com/xJxfMKpFWc
2016-04-11,261819098,Hollywood,#election #president #BernieSanders #HillaryClinton #DonaldTrump #Sanders #Clinton #Trump http://m.dailykos.com/stories/1511265  pic.twitter.com/yoPMg8AhCC
2016-04-11,261819098,Hollywood,#election #president #BernieSanders #HillaryClinton #DonaldTrump #Sanders #Clinton #Trump http://goo.gl/2ch0FE  pic.twitter.com/XMRjhRROhQ
2016-04-11,261819098,Hollywood,#election #president #BernieSanders #HillaryClinton #DonaldTrump #Sanders #Clinton #Trump http://usuncut.com/politics/bernie-sanders-pope-clinton-fundraiser/ … pic.twitter.com/CWueqT2agt
2016-04-11,261819098,Hollywood,#election #president #BernieSanders #HillaryClinton #DonaldTrump #Sanders #Clinton #Trump https://www.facebook.com/events/1014915611935618/ … pic.twitter.com/OTXfiq8JRz
2016-04-11,261819098,Hollywood,#election #BernieSanders #HillaryClinton #DonaldTrump #Sanders #Clinton #Trump http://www.salon.com/2016/04/11/this_is_why_people_dont_trust_hillary_how_a_convenient_reversal_on_gun_control_highlights_her_opportunism/ … via @Salon pic.twitter.com/4ttmjN3CZb
2016-04-11,261819098,Hollywood,#election #president #BernieSanders #HillaryClinton #DonaldTrump #Sanders #Clinton #Trump http://www.newyorker.com/humor/borowitz-report/clinton-campaign-accuses-sanders-of-trying-to-win-nomination … pic.twitter.com/VU7yXl7BAQ
2016-04-11,261819098,Hollywood,#election #president #BernieSanders #HillaryClinton #DonaldTrump #Sanders #Clinton #Trump http://wegoted.com/videos/trump-says-primaries-on-both-sides-are-corrupt/ … pic.twitter.com/vQshVkllqc
2016-04-11,261819098,Hollywood,#election #president #BernieSanders #HillaryClinton #DonaldTrump #Sanders #Clinton #Trump https://youtu.be/9c7AssSB3tc  pic.twitter.com/Xc0sRZJmjq
