date,user_id,location,tweet
2016-06-14,104671648,"Brooklyn, NY",We have a choice. Each election provides us with a choice. What kind of America do you want to…  https://www.instagram.com/p/BGoyrsRLx2N/ 
2016-06-14,30873,SanFrancisco,Working the Election today ... doing my little civic duty for democracy  https://www.swarmapp.com/c/bF9PaQ4Vv7V  pic.twitter.com/gvm4o7ZaXW
2016-06-14,56779844,RiggsParkDC,"Important election for DC council, cool to be able to vote for one of my #SJC classmates…  https://www.instagram.com/p/BGojvrQkmS4/ "
2016-06-14,81913437,"Washington, DC",Voters in D.C. could hand Hillary Clinton a final victory in the last primary election of Decision2016.  http://nbc4dc.com/aDj9taP 
2016-06-13,831797707,"SilverSpring, MD","Election year dispatch from Conspiracy Theory Central, Washington, DC @ Washington, District of…  https://www.instagram.com/p/BGmXrovJUnX/ "
2016-06-12,3887611992,,@DrJillStein Get off twitter!  You could cost the Democrat the election.  Dad  you really want Trump?  Foolish woman!
2016-06-10,245519414,"Washington, DC",@realDonaldTrump Hopping on the #election roller coaster! @realdonaldtrump hillaryclinton #fdparty @ Union…  https://www.instagram.com/p/BGfnngngTNE/ 
2016-06-09,25294430,NYNY,I'm With Snoopy<Emoji: Double exclamation mark> #<Emoji: Thumbs up sign (medium light skin tone)> #<Emoji: Flag of United States> #snoopy #snoopyforpresident #schulz #peanuts #election…  https://www.instagram.com/p/BGcPZg9t8xP/ 
2016-06-07,15961483,"Chicago, IL, USA",Bring on the general election! I just wish my mother had lived to see this moment. #Imwithher @…  https://www.instagram.com/p/BGYILamCffP/ 
2016-06-07,3006289449,cherry,@HillaryClinton @FoxNews Leave it up to the low info people to put a criminal up for election for the president.     Unbelievable!
2016-06-07,66179557,"Baltimore, MD",WJZ: Critics call it an “absolute disaster”. Now city leaders are demanding answers about primary election  http://baltimore.cbslocal.com/2016/06/06/baltimore-primary-dubbed-absolute-disaster-by-critics/?utm_medium=social&utm_source=twitter_CBSBaltimore …
2016-06-06,63108686,Listeningtomusicinthecar,Lol just saw a 'purge 3: election year' movie promotion and the tag line was 'keep America great'...now where have I heard that before?<Emoji: Thinking face>
2016-06-05,3887611992,,"@tonydokoupil Thank God we won't be stuck with a socialist from Vermont, who can't win a general election. Let's thank God for that,  Tony."
2016-06-04,253116832,"Washington, DC","America, we might call this an election, but the rest of the world is viewing it as our I.Q.…  https://www.instagram.com/p/BGP4-YUBSV0/ "
2016-06-03,66179557,"Baltimore, MD","Activists ask for a new primary election in Baltimore, alleging a series of irregularities, ""vote-buying scheme.""  http://bsun.md/1TZXcjq "
2016-06-02,764061452,"Kensington, MD",R CA election officials being told to give Indies provisional ballots? Illegal!
2016-06-01,66179557,"Baltimore, MD",Sheila Dixon won't file lawsuit challenging Baltimore primary election.  http://bsun.md/1Wxhx1H 
2016-05-31,374593397,"Baltimore, MD","The Flamingo has a new ""do"", just in time for #honfest, Flag Day and the Election Year!…  https://www.instagram.com/p/BGF61MUryQb/ "
2016-05-31,28247061,"Washington, DC",Work travel is never an excuse for missing Election Day! #imwithher #dcprimary @ Meridian at…  https://www.instagram.com/p/BGFw1JkOm2Q/ 
2016-05-31,764061452,"Kensington, MD","'Rigged' 2016 Election Has Voters Feeling Helpless, Unheard, and Ashamed -  http://goo.gl/BThsfs "
2016-05-31,66179557,"Baltimore, MD",Sheila Dixon won't seek a recount of Baltimore primary election results.  http://bsun.md/1UshP6o 
2016-05-31,104718610,"Maryland, USA",SB861 [Vetoed] Frederick County - Dry Election Districts - Repeal  http://bitly.com/YK53Tr 
2016-05-31,104718610,"Maryland, USA",HB1352 [Vetoed] Wicomico County Board of Education - Election and Appointment of Members http://bitly.com/WDhRw9 
2016-05-31,264158402,"Washington, DC","election reporters--If you want to explain to your readers Wall Street issues that candidates debate, this may help. http://www.citizen.org/documents/Too-Big-Invite-June2016.pdf …"
2016-05-31,2846211670,"Edgewater, MD","SGA Honor Ceremony & Election <Emoji: Ballot box with ballot> (@ The Summit School in Edgewater, MD)  https://www.swarmapp.com/c/dOfPSvxouiD "
2016-05-30,3303339813,"Miami, FL",#TB #USA #Presidential #Candidate #2016 #US #election #latina #arab #teacher #millennial…  https://www.instagram.com/p/BGC4fJqO6nQ/ 
2016-05-27,3887611992,,@ThomasARoberts General election.
2016-05-27,3887611992,,"@joshrogin He's made this process terrible.  If he ever managed to get the nomination, this would be the first election I ever actively"
2016-05-25,66179557,"Baltimore, MD",The election results in Baltimore have been recertified following the state investigation and counting of some…  http://toplocalnow.com/united-states/maryland/baltimore …
2016-05-24,66179557,"Baltimore, MD","The state review found that about 1,650 ballots were handled improperly in the Baltimore election. http://bsun.md/1We2k5y "
2016-05-23,66179557,"Baltimore, MD","""This is worse than what anybody thought,"" activist says of Baltimore election review. http://bsun.md/1We2k5y "
2016-05-22,3887611992,,@jaketapper Your negative reporting will not cause Democrats to lose the national election with Hillary at top of ticket.  WS will win
2016-05-21,366757444,Maryland,Syl Sobel/Paul Czajak on our Rock the Vote! panel @ #GBF -nonfiction/ fiction works about the prez election process! pic.twitter.com/O2Bal7doYt
2016-05-20,2963402740,America|Ghana,Future Africa Foundation.Peace For All Campaign - Ghana.Election Monitoring Intelligence -…  https://www.instagram.com/p/BFo0qAYy9oJ/ 
2016-05-19,3887611992,,@j_weavTU Election.  Just go home and take Bernie and his wife with you!
2016-05-19,66179557,"Baltimore, MD",State review finds widespread irregularities in Baltimore election. breaking  http://bsun.md/27F9iEw 
2016-05-19,2963402740,America|Ghana,Future Africa Foundation.Peace For All Campaign.Election Monitoring Intelligence.Future…  https://www.instagram.com/p/BFmhkw_S9kP/ 
2016-05-19,2963402740,America|Ghana,Future Africa Foundation.Peace For All Campaign.Election Monitoring Intelligence.Future…  https://www.instagram.com/p/BFmhYc4y9j8/ 
2016-05-19,2963402740,America|Ghana,Future Africa Foundation.Peace For All Campaign.Election Monitoring Intelligence.Future…  https://www.instagram.com/p/BFmg8Cty9iv/ 
2016-05-18,286818739,"Washington, DC",NYTimes: Austria’s Election and the rise of 21st Century Fascism   http://nyti.ms/24ZKF2Y 
2016-05-17,45177227,DC,no candidates running for the At-Large @councilofdc seat in next month's election present at tonight's #ANC5E mtg #DCision16
2016-05-17,66179557,"Baltimore, MD","After emergency petition, Sheila Dixon campaign and election officials agree to expanded hours for public to…  http://toplocalnow.com/united-states/maryland/baltimore …"
2016-05-17,66179557,"Baltimore, MD",Sheila Dixon has filed an emergency petition to allow the public to observe the state review of city election…  http://toplocalnow.com/united-states/maryland/baltimore …
2016-05-17,66179557,"Baltimore, MD",The public review of the state's investigation into the city election was short-lived. Process is now closed again.…  http://toplocalnow.com/united-states/maryland/baltimore …
2016-05-17,37738073,"ÜT:38.927579, -77.106007",About to join @FoxNews to talk about this remarkable election.  Join us!
2016-05-16,66179557,"Baltimore, MD",Elections officials to open to the public the precinct-level of Baltimore election irregularities @lukebroadwater  http://toplocalnow.com/united-states/maryland/baltimore …
2016-05-16,3887611992,,@SenJeffMerkley Bernie Sanders in a general election. His Independent vote message is a ruse.  Not effective at all.
2016-05-16,66179557,"Baltimore, MD",State election bd giving media & candidates access to city election canvas process tomorrow morning @jemillerwbal  http://toplocalnow.com/united-states/maryland/baltimore …
2016-05-16,142979922,"Washington, D.C","""@PpollingNumbers: Georgia general election:Trump 45% (+4%)Clinton 41%Atlanta Journal Constitution pollFYI: Romney won GA by 8%"
2016-05-16,66179557,"Baltimore, MD",Elections board just barred me & Paul Gessler from observing the state inquiry into the city's election…  http://toplocalnow.com/united-states/maryland/baltimore …
2016-05-13,2390302188,"Cary, NC",Truly awesome. If only everyone could spend time connecting here before the election. #dcbynight…  https://www.instagram.com/p/BFX-LoErWhl/ 
2016-05-13,377164327,"Washington, DC",@ChavezSchools Talked about my career in #journalism #news #politics & covering the election at @chavezschools.…  https://www.instagram.com/p/BFWmQIcOKXK/ 
2016-05-13,198219199,"Bensalem, PA│Washington, DC",Practicing my presidential wave since I hear the general election could be wide open. <Emoji: Flag of United States>…  https://www.instagram.com/p/BFWXhFVMmTV/ 
2016-05-13,66179557,"Baltimore, MD",State Board of Elections Orders Baltimore Election Results De-Certified WJZ | CBS Baltimore  http://cbsloc.al/1s4ZCT0 
2016-05-13,66179557,"Baltimore, MD",WJZ: State Board of Elections Orders Baltimore Election Results De-Certified  http://baltimore.cbslocal.com/2016/05/12/state-board-of-elections-orders-baltimore-election-results-de-certified/?utm_medium=social&utm_source=twitter_CBSBaltimore …
2016-05-12,74057921,"Montreal, QC, Canada","#Vote Doumbia instead. #election #fun <Emoji: Winking face> #houseofcards @ Washington, District of Columbia  https://www.instagram.com/p/BFVKyBMpsAR/ "
2016-05-12,66179557,"Baltimore, MD",State Board of Elections orders Baltimore election results de-certified  http://cbsloc.al/1XnfuMJ 
2016-05-12,66179557,"Baltimore, MD",Did you experience issues voting on Election Day? Were you an poll judge/worker in Baltimore? Email…  http://toplocalnow.com/united-states/maryland/baltimore …
2016-05-12,66179557,"Baltimore, MD",Decertification of city election resets clock for challenge to results..Window again open @jemillerwbal  http://toplocalnow.com/united-states/maryland/baltimore …
2016-05-12,66179557,"Baltimore, MD",Election workers from other jurisdictions helping city reconcile its paperwork. Chief says similar problems have…  http://toplocalnow.com/united-states/maryland/baltimore …
2016-05-12,66179557,"Baltimore, MD",WJZ has confirmed that the State Board of Elections has ordered the Baltimore election results be de-certified.…  http://toplocalnow.com/united-states/maryland/baltimore …
2016-05-12,66179557,"Baltimore, MD","State orders Baltimore's election results decertified, begins precinct-level review of irregularities. breaking  http://bsun.md/1XncIqT "
2016-05-12,66179557,"Baltimore, MD","In whole portions of Baltimore, not a single Republican cast a vote this primary election  http://data.baltimoresun.com/news/elections2016/baltimore-voting-map/index.html …"
2016-05-11,66179557,"Baltimore, MD",Sheila Dixon says she will not seek recount of mayoral election votes @jemillerwbal  http://toplocalnow.com/united-states/maryland/baltimore …
2016-05-11,13412962,"ÜT:35.113177, -80.676333","We appreciate our Realtor champion, Rep Richard Hudson! Vote in the special June 7 election,…  https://www.instagram.com/p/BFRiMTQxPPN/ "
2016-05-11,3290470810,Mid-Atlantic,"Thanks to my great campaign manager, Sarah, I won the election for…  https://www.instagram.com/p/BFRctf8Ie0xyfPQ7YXfrTRwBiR52NOKotTNUv00/ …"
2016-05-10,81913437,"Washington, DC",The Marijuana Policy Project released a guide for D.C.'s upcoming election  http://www.washingtoncitypaper.com/blogs/citydesk/2016/05/10/report-card-how-do-d-c-council-candidates-stack-up-on-marijuana/ …
2016-05-09,66179557,"Baltimore, MD",Balt City Bd of Elections just certified election results. Pugh official Dem Mayoral nominee. Record turnout…  http://toplocalnow.com/united-states/maryland/baltimore …
2016-05-09,37738073,"ÜT:38.927579, -77.106007",Will be on @FoxNews at 1140am talking about this remarkable election.  Join us!
2016-05-08,372555541,SouthFlorida,Watching 2012 Election Night coverage all the way through because…  https://www.instagram.com/p/BFKmYWAStFkSY9Jdyc8z87UGUkNAKVRlI0JlvI0/ …
2016-05-06,66179557,"Baltimore, MD",Trump to face trial after election in Trump University suit: LiveOnFOX45  http://foxbaltimore.com/news/nation-world/trump-to-face-trial-after-election-in-trump-university-suit …
2016-05-05,21434408,USA 🇺🇸,DC train station gift shop already shifted to general election.  #trump2016 #hillary2016 @ Union…  https://www.instagram.com/p/BFB_RN1PsFD/ 
2016-05-04,61168510,Jakarta,Celebrating peruvian election in advance. If you know what I mean.…  https://www.instagram.com/p/BFAsUy8PuD7F0ObQb5YzAaz0fXs69Rlp-XWawg0/ …
2016-05-04,66179557,"Baltimore, MD","Dixon says they are proposing to reject 3,286 ballots; Election director can't say how many yet WJZ | CBS Baltimore…  http://toplocalnow.com/united-states/maryland/baltimore …"
2016-05-01,3887611992,,@staceyhopkinsga Sanders can't win a national election.  It's up to him to help unite the party.  End of discussion!
2016-04-29,129718597,OmniPresent,Was looking for a pic to post from presumptive new Mayor Pugh's party on election night &…  https://www.instagram.com/p/BEyMwQ2AyzB/ 
2016-04-29,81913437,"Washington, DC",Do you already have election fatigue six months before the general election?VOTE  http://wjla.com/news/nation-world/national-world-question-of-the-day …
2016-04-29,3433659718,"Waterloo, IA",Election 2016: Democrats aim to strap House Republicans to Trump  http://bit.ly/23aXEfv  #MGWV #TFB #F4F
2016-04-28,45177227,DC,received in today's mail: @dcboee Voter's Guide for the 06-14-2016 primary election #BloomingdaleDC #DCision16 pic.twitter.com/XdyHmEOgtc
2016-04-28,33134967,"Washington, DC",Deven Anderson talking to the group about what's at stake in this election. #BYV16…  https://www.instagram.com/p/BEwJRgtJk5u/ 
2016-04-27,104718610,"Maryland, USA",HB1077 [Passed] Montgomery County Board of Elections - Election Director - Appointment Requirement MC 26-16 http://bitly.com/WBh7b4 
2016-04-27,236210717,"Baltimore, MD",Primary election is over . Time to pick up signs- Harford and…  https://www.instagram.com/p/BEtLMuUFEECxmoPBv8GsMXtpOd0VPD8GeL4sVY0/ …
2016-04-27,104718610,"Maryland, USA",HB241 [Passed] Election Law - State Elected Officials - Campaign Fund-Raising During General Assembly Session - C... http://bitly.com/Y1IQjj 
2016-04-27,104718610,"Maryland, USA",HB1008 [Passed] Election Law - Early Voting Centers http://bitly.com/WArSud 
2016-04-27,104718610,"Maryland, USA","HB344 [Passed] Voter Registration - Affiliation With Political Party and Participation in Primary Election, Caucu... http://bitly.com/W5djP1 "
2016-04-26,104718610,"Maryland, USA",SB145 [Passed] Wicomico County Board of Education - Election and Appointment of Members http://bitly.com/VMLOcE 
2016-04-26,1912334989,,A big THANK YOU to all those who voted for me in the BOE primary allowing me to finish first and advance to the general election in Nov.
2016-04-26,13472812,BaltimoreCity,Next election I'm voting for any and all candidates who promise to do something about these…  https://www.instagram.com/p/BEsH8FcuV3Z/ 
2016-04-26,3918781,BackwhereIstarted,"End of a long day beer. Good election day, meh results. Sort of like this tar... (BeerGarten Tart)  http://untp.beer/s/c304435962 "
2016-04-26,36221940,"Baltimore, MD",@ElectRyanDorsey At the @electryandorsey election results party. Democracy is awesome…  https://www.instagram.com/p/BEsDVKWJqECR7idmwn0OOimdvO4n9ukwYKHog80/ …
2016-04-26,66179557,"Baltimore, MD",At moment Pugh and Dixon almost even on Election Day voting but Pugh had big edge in early voting..Pugh 38% Dixon…  http://toplocalnow.com/united-states/maryland/baltimore …
2016-04-26,8719302,Baltimore&Toronto,docbullock with his students at the election watch party. It looks like he's going to win with…  https://www.instagram.com/p/BEr7CDnMUO8/ 
2016-04-26,16610066,Maryland,#Election (@ Hoco Board Of Elections)  https://www.swarmapp.com/c/8E6ZyGY4zi9 
2016-04-26,104718610,"Maryland, USA",HB873 [Passed] Election Law - Special Elections - Absentee Ballots for Absent Uniformed Services Voters and Overs... http://bitly.com/WzfCtR 
2016-04-26,284677404,"Washington, DC",At the @jamie_raskin election watch party in Silver Spring! #jamieraskin #teamraskin…  https://www.instagram.com/p/BEr3haKA8_5/ 
2016-04-26,203364243,,Dutch Rupersberger hitting the media circus at #chrisvanhollen election HQ @ Bethesda Marriott  https://www.instagram.com/p/BEr2up-R-3B/ 
2016-04-26,66179557,"Baltimore, MD",Here's an interesting tidbit: Steny Hoyer has arrived at Chris Van Hollen election night party. He was neutral.  http://toplocalnow.com/united-states/maryland/baltimore …
2016-04-26,104718610,"Maryland, USA","SB170 [Passed] Voter Registration - Affiliation With Political Party and Participation in Primary Election, Caucu... http://bitly.com/VMHev6 "
2016-04-26,789158,"Canton, Baltimore, MD","Election Night. <Emoji: Flag of United States><Emoji: Flag of United States><Emoji: Flag of United States> (@ Liam Flynn's Ale House - @liams_ale_house in Baltimore, MD)  https://www.swarmapp.com/c/jNO7qTCuELi "
2016-04-26,3040784619,"Baltimore, MD",No pre-school on Election Day turned into take your daughter to work…  https://www.instagram.com/p/BEroxO0inMY1Xocd3xPsWIBF9BRpzSeA_eLJf40/ …
2016-04-26,473625258,518N.CharlesStreet,It's Tuesday! And this Tuesday means three things!1.) Primary Election Watch Party2.) Tuesday…  https://www.instagram.com/p/BErnyG6CeHr/ 
2016-04-26,24459128,"Washington, DC",Guess what today is Marylanders? #TacoTuesday!Also primary election day. #govote ! #yovoté…  https://www.instagram.com/p/BErjNEEkCLg/ 
2016-04-26,14505234,DCandsurroundingenvirons,"Election judging! (@ Rockview Elementary School in Kensington, MD) https://www.swarmapp.com/c/eEkCUQ2529D "
2016-04-26,19140465,"Maryland, USA","Donna Edwards election night headquarters (@ IBEW Local 26 Hall in Lanham, MD) https://www.swarmapp.com/c/e1Xmv6bBK15 "
2016-04-26,104718610,"Maryland, USA",SB408 [Passed] Election Law - State Elected Officials - Campaign Fund-Raising During General Assembly Session - C... http://bitly.com/WdCcbi 
2016-04-26,22633464,"iPhone:39.311993, -76.614616",Election Day mysteries... Tons of empty voting booths yet a line for 30 minutes to get to occupy…  https://www.instagram.com/p/BErWlhzFztn/ 
2016-04-26,104718610,"Maryland, USA",HB112 [Passed] Election Law - Campaign Finance Entities - Expenditures Made and the Attribution of Contributions ... http://bitly.com/VKae6H 
2016-04-26,2750848145,,"Happy Election Day <Emoji: Flag of United States> @ Columbia, Maryland  https://www.instagram.com/p/BErINnfFUbiyUzkHpUy-WmNbGRunpxVfwDn8E80/ …"
2016-04-26,66179557,"Baltimore, MD","City election director addresses missing ""I Voted"" stickers, says confusion over machines has been biggest problem.  http://bsun.md/24hRqwS "
2016-04-26,290563098,"Baltimore, Md",Get out and vote guys! <Emoji: Flag of United States>#election #electionday #2016election #2016 #hilaryclinton…  https://www.instagram.com/p/BErFAw8y8Ta/ 
2016-04-26,121949605,"Baltimore, MD",Election Day donuts from @fpdoughnuts #ivoted @ Fractured Prune of Parkville  https://www.instagram.com/p/BErBfl1t_HL/ 
2016-04-26,66179557,"Baltimore, MD","Official word on popular ""I Voted"" stickers in Baltimore. City election board didn't pack them for 296 precincts,…  http://toplocalnow.com/united-states/maryland/baltimore …"
2016-04-26,29996633,"Washington, DC",I voted! Did you? #vote #rockthevote #election #2016 #presidentialprimary #getoutandvote @…  https://www.instagram.com/p/BEq4vqoCJ7D/ 
2016-04-26,22322405,"Baltimore, FedHill",Election Day kids lunch @ Little Havana Restaurante y Cantina  https://www.instagram.com/p/BEq0CnBFOux/ 
2016-04-26,20777616,"Burtonsville, MD",Happy Primary Election Day!  This is what 'Merica is all about!  #SmokinMeat #democracy…  https://www.instagram.com/p/BEqz9UOjWPb/ 
2016-04-26,110449107,,Happy Election Day!!! Please please please get out and vote today! @…  https://www.instagram.com/p/BEqkrIsmfaZvavl3-5sYi8PP3u1b57VXbpVbSg0/ …
2016-04-26,38873484,"Baltimore, Maryland","@BaltimoreFire Here do election judging for Baltimore City (@ BCFD - Inner Harbor Station - @baltimorefire in Baltimore, MD) https://www.swarmapp.com/c/0rprbAaSdJv "
2016-04-26,18586983,"Brooklyn, NY",Kicking off a HUGE Election Day for women with Ellen Malcolm & Anita…  https://www.instagram.com/p/BEqfez8QB1VUQj_RaIllYCX6oVL0-FHB0FH_sw0/ …
2016-04-26,1292951,Maryland,"Serving as Election judge #MDPrimary (@ Lake Elkhorn Middle School in Columbia, MD) https://www.swarmapp.com/c/9UJ6Ven3uMN "
2016-04-26,35012976,"Washington, D.C.",Maryland Primary Presidential Primary Election!! Time to VOTE from now until 8pm! Many of the…  https://www.instagram.com/p/BEqZ9w_EY_v/ 
2016-04-26,66179557,"Baltimore, MD","Happy Election Day, Maryland. Here's your eNewspaper. http://bsun.md/eedition "
2016-04-26,66179557,"Baltimore, MD",2016 Maryland presidential primary election results  http://bit.ly/1NOCmxe 
2016-04-25,81913437,"Washington, DC",The polls open at 7 a.m. in Maryland for primary election day. All candidates are hoping voters will come out.  http://nbc4dc.com/t1hg9ru 
2016-04-25,27953251,"Baltimore, MD",This is the most important election of our lifetime. President.…  https://www.instagram.com/p/BEpVqvUNN1Gxq9vWDWIdTM5SorUP-UgxPiYwak0/ …
2016-04-25,66179557,"Baltimore, MD","Voting tomorrow? Here's The Baltimore Sun's election guide for Baltimore mayor & council, US Senate & Congress.  http://data.baltimoresun.com/voter-guide-2016/ …"
2016-04-25,341109605,"Baltimore, MD",@CBSBaltimore Live Pre-Primary Election Day Coverage #primaryelection2016 @cbsbaltimore @ Baltimore Inner Harbor  https://www.instagram.com/p/BEo3t4fnhPb/ 
2016-04-24,66179557,"Baltimore, MD",Baltimore's incumbent council president and comptroller declined to debate challengers ahead of the election.  http://bsun.md/21aXyoM 
2016-04-23,494305477,"Washington, DC|NewYork|HudsonValley","As we approach the election, we need to engage young people with the campaigns + issues that matter to them. This is my goal @GWCollegeDems"
2016-04-22,66179557,"Baltimore, MD",Early voting ended yesterday with record-high turnout across Maryland for a primary election.  http://bsun.md/1XLE5J8 
2016-04-22,27953251,"Baltimore, MD",Election day approaches. You can help shape the next 4 years in our…  https://www.instagram.com/p/BEgLZBMtNw-LQCkxsUZZxkBwakevkKWoKRfnik0/ …
2016-04-20,143667425,"Washington, DC",B21-0675 [Passed] Primary Election Filing Requirement Emergency Amendment Act Of 2016  http://bitly.com/1qsYFn3 
2016-04-20,31019025,"NEWYORK, MIAMI, ATL, DMV, LA",<Emoji: Large red circle><Emoji: Trident emblem>#SheilaDixonforMayor | April 26th Election Day featuring Shelia Dixon (@SheilaforMayor)... We…  https://www.instagram.com/p/BEcWVshA_Lo/ 
2016-04-20,31019025,"NEWYORK, MIAMI, ATL, DMV, LA",<Emoji: Large red circle><Emoji: Trident emblem>#SheilaDixonforMayor | April 26th Election Day featuring Shelia Dixon (@SheilaforMayor)... We…  https://www.instagram.com/p/BEcWJC8g_LX/ 
2016-04-20,31019025,"NEWYORK, MIAMI, ATL, DMV, LA",<Emoji: Large red circle><Emoji: Trident emblem>#SheilaDixonforMayor | April 26th Election Day featuring Shelia Dixon (@SheilaforMayor)... We…  https://www.instagram.com/p/BEcWAIyg_LJ/ 
2016-04-20,31019025,"NEWYORK, MIAMI, ATL, DMV, LA",<Emoji: Large red circle><Emoji: Trident emblem>#SheilaDixonforMayor | April 26th Election Day featuring Shelia Dixon (@SheilaforMayor)... We…  https://www.instagram.com/p/BEcV1qAA_K1/ 
2016-04-20,31019025,"NEWYORK, MIAMI, ATL, DMV, LA",<Emoji: Large red circle><Emoji: Trident emblem>#SheilaDixonforMayor | April 26th Election Day featuring Shelia Dixon (@SheilaforMayor)... We…  https://www.instagram.com/p/BEcVtOfA_Km/ 
2016-04-20,31019025,"NEWYORK, MIAMI, ATL, DMV, LA",<Emoji: Large red circle><Emoji: Trident emblem>#SheilaDixonforMayor | April 26th Election Day featuring Shelia Dixon (@SheilaforMayor)... We…  https://www.instagram.com/p/BEcVcFWA_KQ/ 
2016-04-20,31019025,"NEWYORK, MIAMI, ATL, DMV, LA",<Emoji: Large red circle><Emoji: Trident emblem>#SheilaDixonforMayor | April 26th Election Day featuring Shelia Dixon (@SheilaforMayor)... We…  https://www.instagram.com/p/BEcVUhFg_KB/ 
2016-04-20,31019025,"NEWYORK, MIAMI, ATL, DMV, LA",<Emoji: Large red circle><Emoji: Trident emblem>#SheilaDixonforMayor | April 26th Election Day featuring Shelia Dixon (@SheilaforMayor)... We…  https://www.instagram.com/p/BEcU3CnA_Jb/ 
2016-04-20,31019025,"NEWYORK, MIAMI, ATL, DMV, LA",<Emoji: Large red circle><Emoji: Trident emblem>#SheilaDixonforMayor | April 26th Election Day featuring Shelia Dixon (@SheilaforMayor)... We…  https://www.instagram.com/p/BEcUiXxA_I-/ 
2016-04-20,31019025,"NEWYORK, MIAMI, ATL, DMV, LA",<Emoji: Large red circle><Emoji: Trident emblem>#SheilaDixonforMayor | April 26th Election Day featuring Shelia Dixon (@SheilaforMayor)... We…  https://www.instagram.com/p/BEcUW7yg_Il/ 
2016-04-20,19123904,"Washington, DC20009",Election year #sexism against Hillary Clinton by Bernie Sanders & his disgusting Bros brought me closer to my mother  http://ow.ly/3zCJHz 
2016-04-20,209180010,UnitedStates,#ByTheNumbers To show just how close the last election was. Only 44…  https://www.instagram.com/p/BEbZQn0lwIRKWcKSuNG-WP_7D866AgPaezNao00/ …
