date,user_id,location,tweet
2016-09-22,473927663,ST.LOUIS,BLACK PEOPLE DONT VOTE THIS ELECTION<Emoji: Raised fist> The candidates are white supremists and they all treat the…  https://www.instagram.com/p/BKqRDBdjOgh/ 
2016-09-22,17155867,"Washington, DC",Supposedly a veterinary chart. Seems like it could have uses in this election. @ Takoma Park…  https://www.instagram.com/p/BKqPQFMB3Ko/ 
2016-09-21,56599807,NASHVILLE+CHICAGO,Out here covering the presidential election with the team <Emoji: Flag of United States><Emoji: Movie camera><Emoji: Hugging face> I just wanna know which…  https://www.instagram.com/p/BKoktKShhjE/ 
2016-09-21,162156431,"Washington, DC","DC can be really exhausting, lonely and stressful, especially around the election season. So I…  https://www.instagram.com/p/BKoSXlLAGiE/ "
2016-09-20,143667425,"Washington, DC",PR21-0890 [NEW] Election Day Change Of Address Emergency Declaration Resolution Of 2016  http://bitly.com/2dfORu8 
2016-09-19,143667425,"Washington, DC",B21-0860 [NEW] Election Day Change Of Address Emergency Amendment Act Of 2016  http://bitly.com/2cNeSy4 
2016-09-19,15264536,"Washington, DC",Indecisive in this years election? Just want to move and not vote for neither party? I hear the…  https://www.instagram.com/p/BKilpGrhX8n/ 
2016-09-18,14864105,"Washington, DC","This image pretty much sums up everything about this election. @ Washington, District of Columbia  https://www.instagram.com/p/BKgsPzFBLmZ/ "
2016-09-18,2886194499,LagosNigeria,#innocence and #nature  can sense danger<Emoji: Negative squared cross mark><Emoji: Negative squared cross mark> #election #election2016 #instadaily #likeforlike…  https://www.instagram.com/p/BKgXVSrAtQe/ 
2016-09-17,34826366,GoldCoastAustralia,TRUMPY-POP .. we shall over comb <Emoji: Smiling face with open mouth and tightly-closed eyes> .. is there an election coming ? @ It's Sugar  https://www.instagram.com/p/BKdiyaaDNNU/ 
2016-09-15,344127226,,.@DrOz Show one-on-one w @realDonaldTrump is on @CMOREDC (DC20) at 1pm. #DVR This election is so #juicy. Those o' sex scandals are so '90s <Emoji: Unamused face>
2016-09-14,168354036,WashingtonD.C,#CBCatDNC with #donnabrazile  54 days till election time!! #IWillvote #dc #dmv #difilms @…  https://www.instagram.com/p/BKWxjrJBLZ0/ 
2016-09-14,15951349,"Fremont, CA",Day 1 in #virWINia... T-55 days until election day. #imwithher @ Ready for Hillary PAC  https://www.instagram.com/p/BKWXXTIBVD8/ 
2016-09-13,3887611992,,@kasie Wow!  Didn't mention anything about media not coming this election fairly.  Not a mention!
2016-09-13,22812754,"Queens, NewYork",Tune into CNN now! I'll be discussing the 2016 Presidential election in a few moments. @ Cannon…  https://www.instagram.com/p/BKTQLgGAZg1/ 
2016-09-13,66179557,"Baltimore, MD",Campaigns look to lock in support before Election Day  http://dlvr.it/MFk45v 
2016-09-13,3887611992,,@meganmurp Hillary will soldier through this and win this election.  She will make you eat your disgusting words!
2016-09-13,17972308,StateofMaryland,The #Baltimore unity ticket for the fall election #MDpolitics @ Baltimore City Hall  https://www.instagram.com/p/BKS_268AFQ8/ 
2016-09-12,509286938,UnitedStates,Final day of the the weekend convention. As done each election year…  https://www.instagram.com/p/BKSDh24DrwuC39Y5Ln2zmFW6J6DOA0CmdoUQng0/ …
2016-09-12,18129188,Gotham,Beautiful #dataviz from the 1968 presidential election encapsulating the incredible travel put…  https://www.instagram.com/p/BKRB_MtgWi_/ 
2016-09-12,180467274,ALB ✈️DCA ✈️DUB,Already thinking critically about my @instagram caption for outside the White House on election night. #ImWithHer <Emoji: Happy person raising one hand (medium light skin tone)><Emoji: Flag of United States>
2016-09-11,681473,"TakomaPark, MD",I once got pneumonia after working on the Winter Olympics coverage at the NYT. I imagine a presidential election must be very grueling
2016-09-11,47061881,VA-DC,9.11.16 @spzn GTOWN again for TOMS election shoe break out! Come…  https://www.instagram.com/p/BKOkj_zhogu6v7WIvWaMOU8jrc9VOzKOey8Wbk0/ …
2016-09-10,19123904,"Washington, DC20009","The self-proclaimed ‘Campaign Guru’ convicted on all federal election charges, faces jail time... Loser. Sad. http://ow.ly/T6Ku100jGyq "
2016-09-10,3236558747,"LosAngeles, CA","""We must run, not walk, to the podiums this election. Donald Trump is unfit to be President of…  https://www.instagram.com/p/BKMyDc2AIjK/ "
2016-09-10,3887611992,,"@AsheSchow His job.  Hillary had nothing to worry about.  She will win this election based on real policies. Get your facts straight.  Oh,"
2016-09-09,556135207,"Washington, DC",French magazine Phosphore journalist interviewing RW students on presidential election…  https://www.instagram.com/p/BKJJXHVBRy7/ 
2016-09-09,772600094491369472,,@LGBTLabour @HRC Incredible to learn that the LGBT could make up a margin of victory in this election @hrc @lgbtlabour
2016-09-08,66179557,"Baltimore, MD",Towson basketball coach requiring players to vote in November election  http://cbsloc.al/2cxHCtV 
2016-09-08,1605668706,"Maryland, USA","#TruthBeTold your #votematters every election #Vote  ""It is during our darkest moments that we…  https://www.instagram.com/p/BKF9b21h2po/ "
2016-09-07,16562920,,"1976 Election Coverage @ Washington, District of Columbia  https://www.instagram.com/p/BKEpnapgYpB/ "
2016-09-07,2733802269,121618THSTNWDC,WHO SAYS to never talk politics in a bar?! Sauf Haus is your Election Headquarters in…  https://www.instagram.com/p/BKD-9kkBkH-/ 
2016-09-05,15505728,"Richmond, VA23220",LCV Action Fund Endorses Candidates from Two Virginia Districts for Election To US Congress…  https://www.instagram.com/p/BJ_CLYRB0DK/ 
2016-09-05,15505728,"Richmond, VA23220",LCV Action Fund Endorses Candidates from Two Virginia Districts for Election To US Congress…  https://www.instagram.com/p/BJ_BUx8BBSS/ 
2016-09-05,15505728,"Richmond, VA23220",LCV Action Fund Endorses Candidates from Two Virginia Districts for Election To US Congress…  https://www.instagram.com/p/BJ_BCddhIn4/ 
2016-09-05,66179557,"Baltimore, MD",Bill Clinton made a surpise at Philly's Made in America fest to register people to vote in the upcoming election. http://cbsloc.al/2crLg8V?utm_medium=social&utm_source=twitter_CBSBaltimore …
2016-09-04,9289832,"NewYork, NY",Like this if you have defriended someone during this election season. I don't unfriend. I…  https://www.instagram.com/p/BJ8pJljAar6/ 
2016-09-02,59212679,"NewYork, NY",Had to make an obligatory visit to The White House. Only 67 Days till Election Day... <Emoji: Flag of United States><Emoji: Flag of United States> #DC…  https://www.instagram.com/p/BJ3g_p_jDfh/ 
2016-09-02,3887611992,,@evanperez And win this election.  You and your kind won't win!  She will brush you off her shoulders like lint on a cleanly pressed suit.
2016-09-02,608243816,"Washington, DC",Georgetown's slavery restitution is great.  Except waiting so long and doing it in an election year makes it seem like a PR stunt.
2016-09-01,243929843,"Washington, DC",When it's Thursday and 68 days until election day and there's a tub…  https://www.instagram.com/p/BJ0q8scgLN4obVnLRY90Pe-2_fKj7GGHYj7uNk0/ …
2016-08-30,66179557,"Baltimore, MD",FBI: U.S. election could be under attack by hackers http://cbsloc.al/2c9akBq 
2016-08-29,1171561028,"Washington, DC",Finally on Instagram ! Here's to follow our adventures during this crazy election year. @…  https://www.instagram.com/p/BJtfKxtgulF/ 
2016-08-28,29579405,"Philadelphia, PA",We're in Baltimore today for a special election year #CatInTheHat4Prez event with…  https://www.instagram.com/p/BJqJro2DjFK/ 
2016-08-28,192718487,London,Just when you thought the US Election could get no worse! @ The…  https://www.instagram.com/p/BJpx4log29N2NP8rywQUTmZcbkjMsLygwo2cec0/ …
2016-08-27,3887611992,,@Ron4VA She will be the next President of the United States. Trump is an undisciplined fool.  He will lose this election and lose badly.
2016-08-27,2317548172,,Drinking an Election Year by Independent Brewing Company @ Independent Brewing Co —  http://untp.beer/s/c353374352 
2016-08-27,66179557,"Baltimore, MD",Court declines to hear appeal on Wisconsin voter ID before election  http://dlvr.it/M78kNd 
2016-08-25,681473,"TakomaPark, MD",Too late I realize this would be great for election progress https://twitter.com/year_progress/status/768930958531633154 …
2016-08-25,681473,"TakomaPark, MD","The election forecasters should also have an ""OMG! NEW POLL!"" model that instead of averaging only uses the latest single poll."
2016-08-24,199324673,"Baltimore, MarylandUSA",Opened request via iphone at 3 W North Ave  http://goo.gl/16gKJx . Why are there still city election signs up? pic.twitter.com/opNYJB7reM
2016-08-24,66179557,"Baltimore, MD","With the election just around the corner, I humbly announce that I am running for supreme ruler of trash affairs.…  http://toplocalnow.com/us/baltimore "
2016-08-23,19123904,"Washington, DC20009","Trump calls for his brown shirt militia to ""watch"" on Election Day: ""When I say watch, you know what I'm talking about."" Voter Intimidation!"
2016-08-22,121899210,"Portland, ME",For all you confederate flag waving #trump supporters #election hillaryclinton  #imwithher…  https://www.instagram.com/p/BJZ45n-ALxF/ 
2016-08-21,223921530,Illinois,"Think this election year is weird? Well, stranger things have happened in the White House. Over…  https://www.instagram.com/p/BJY8kxbBQyC/ "
2016-08-20,1292951,Maryland,Election judge training. (@ Hoco Board Of Elections)  https://www.swarmapp.com/c/6FW3sbRoUxv 
2016-08-18,681473,"TakomaPark, MD",That Georgia is a battleground state tells you a lot about this unusual election http://www.vox.com/2016/8/18/12515240/clinton-win-georgia-iowa-red-states …
2016-08-17,59221053,"Philadelphia, PA",I took this photo of the Washington Monument back in the winter of 2010. With the Election…  https://www.instagram.com/p/BJONPBwhO_v/ 
2016-08-15,66179557,"Baltimore, MD",IAFF General President announced the IAFF will not endorse a candidate in the upcoming Presidential election.…  http://toplocalnow.com/us/baltimore 
2016-08-15,479477102,"Towson, MD",Stop Isis vote trump for president #Trump2016 #RetweeetPlease #election
2016-08-14,19123904,"Washington, DC20009","#TraitorTrump's ""Trump Election Observers"" Brown Shirt Militia is Pushing His Mob to Terrorize Minority Voters: http://ow.ly/ED5Q100h8qi "
2016-08-13,28918980,"Greensboro, NC",Trump campaign doubles down on election fraud claims - CNN  http://dlvr.it/M1w0sk  pic.twitter.com/u6np4DOmI9
2016-08-13,3887611992,,@cjtfarrell You're a fool!  Nothing you present will hurt Hillary.  She will win the election.  You know this.  Just drop this nonsense.
2016-08-12,851361,"Washington, DC","Going on CSPAN at 8:30 to talk about the DNC hack, Russia, and the election."
2016-08-11,307469730,"Washington, D.C.",#ElizabethWarren's real talk has been keeping me sane this election season. #tbt to seeing her…  https://www.instagram.com/p/BI-jac6jIQT/ 
2016-08-10,1421932668,,It's #Official I'm #running for the #Presidential election for #2020. #JustKidding…  https://www.instagram.com/p/BI7va8RAXOO/ 
2016-08-07,160706817,"Aberdeen, Maryland",Drinking an Election Year by Independent Brewing Company @ Independent Brewing Co —  http://untp.beer/s/c346013039 
2016-08-06,28918980,"Greensboro, NC",Trump 'afraid the election's going to be rigged' - New York Daily News  http://dlvr.it/LzHlmR  pic.twitter.com/ssO3fGuMAb
2016-08-06,15369495,"SanAntonio, Texas",Congratulations to brandontvnews on his election as President of #nahj - Make @ksatnews and all…  https://www.instagram.com/p/BIyXhlHBu35/ 
2016-08-05,2352316196,,Currently listening to Hilary Clinton at the #NABJ #NAHJ #Election #NeedAnswers @ Marriott…  https://www.instagram.com/p/BIu-bqug9Q_/ 
2016-08-04,33142966,"Sacramento, CA",Obama: Trump Claims on Rigged Election ‘Ridiculous’  http://bit.ly/2aUqxwK 
2016-08-04,66179557,"Baltimore, MD","QUESTION OF THE DAY:“If the election were held today, which candidate would you support?”FOX45QOD @FOXBaltimore  http://toplocalnow.com/us/baltimore "
2016-08-03,104125182,"Munich, Vienna",Vote Burns #election #usa #trump #trump2016 @ Washington Monument National Monument  https://www.instagram.com/p/BIpwMyUhLfI/ 
2016-08-02,1381202912,"Arizona, USA",My latest article on @elephantjournal focuses on spirituality in this election. Do give it a…  https://www.instagram.com/p/BIoGj9-BRyl/ 
2016-08-02,81913437,"Washington, DC","""I hear things & I just feel it"" Donald J. Trump on if he truly believes the election could be rigged. DonaldTrump…  http://toplocalnow.com/us/washington "
2016-08-02,1180025371,USA,Trend Alert: 'Primary Election Day'. More trends at  http://www.trendinalia.com/twitter-trending-topics/usa/usa-today.html … #trndnl pic.twitter.com/jLXr4W3ijE
2016-08-02,66179557,"Baltimore, MD",Balto. Co. Council rejects tenant anti-discrimination bill 6-1. Settlement requires it try again after '18 election.  http://bsun.md/2aLorAf 
2016-08-01,1617610868,"Washington, DC",WORLD HEALTH MEDICAL ALERT!A STRIKING CONCLUSION N 11/2016 PRESIDENTIAL ELECTION SIGN N2LAW PRESIDENT MICHELLE OBAMA pic.twitter.com/ZmON1J3EBL
2016-08-01,3308229448,"Washington, DC",Haha! Gotta love election years <Emoji: Grinning face with smiling eyes> #election2016 @ Sprig and Sprout  https://www.instagram.com/p/BIkxJ8mjDH7/ 
2016-08-01,173834817,"Bethesda, MD",How will the presidential election impact #MACRA? Read the MACRA Tidbit  http://goo.gl/Ye8kge  pic.twitter.com/PCgPXePwNB
2016-08-01,17139051,"EastVillage, Manhattan",We sure could use Dick Gregory this election season...#aShiningLight #AnAngryLaughter @ The…  https://www.instagram.com/p/BIkiTFWDpEH/ 
2016-07-31,45227138,Chicago/KU,I may or may not have spent 10min manipulating the election results…  https://www.instagram.com/p/BIip5jQBLhFafWDytU5PCc0RaIEttDe8dDyKFU0/ …
2016-07-31,2317548172,,Drinking an Election Year by Independent Brewing Company @ Independent Brewing Co —  http://untp.beer/s/c342917929  #photo
2016-07-31,136550204,"Washington, D.C.",Wonder if Billy Joel will be tempted to write another verse after this crazy election cycle…  https://www.instagram.com/p/BIhxZT8hgNi/ 
2016-07-30,30222655,CapitolHill,I can't really take you seriously if you don't take this election seriously
2016-07-28,57793952,"Washington, DC","""Next election I'm investing in balloons."" - Someone's dad, somewhere. #DNC"
2016-07-28,17649291,"Washington, DC","Eight years ago, I registered with the Democratic Party and voted in my first election. I…  https://www.instagram.com/p/BIawTrcBqJz/ "
2016-07-28,1617610868,"Washington, DC",WORLD HEALTH MEDICAL ALERT! PRESIDENT OF THE UNITED STATES OF AMERICA N ELECTION 2016 SIGN FIRST LADY MICHELLE OBAMA pic.twitter.com/cWHjwDTl9T
2016-07-28,21328230,"RunDMV, USA","""Democracy works, but we have to want it! Not just in an election year but all the days in…  https://www.instagram.com/p/BIZ3H-vDxgm/ "
2016-07-28,47336054,"Adelaide, SouthAustralia","Crooked Hillary, Crooked Bill #usa #election #democrat #whitehouse #l4l #c4c #t4t #president…  https://www.instagram.com/p/BIZsfGSh0ul/ "
2016-07-27,81913437,"Washington, DC","""He's betting if he scares just enough people he'll win this election"". ""It's a bet he'll lose""WUSA9 Northwest…  http://toplocalnow.com/us/washington-0 "
2016-07-27,21076174,"WASHINGTON, D.C.",WATCHING PURGE ELECTION YEAR. #PJVIII #20019 #LEOAUG10 @ Regal Bowie…  https://www.instagram.com/p/BIYV4HTDoSLq4HipjKD91Y4fMnflKaIUFBZ-Yk0/ …
2016-07-26,66179557,"Baltimore, MD",Assange: 'A lot more material' coming on election  http://dlvr.it/Ltv10P 
2016-07-26,45902462,"Washington, DC",This animated intro for Larry Wilmore's The Blackening is this election in 15 secs. #microcosim…  https://www.instagram.com/p/BIVY-uvjmWU/ 
2016-07-25,19123904,"Washington, DC20009",The #DNC's emails show it had no idea how to rig an election... We're lucky to win them as is!  http://ow.ly/VzPD100fwuv  #DemsInPhilly
2016-07-25,81913437,"Washington, DC","Bernie Sanders says, let me be as clear as I can be...this election is about and must be about the needs of the…  http://toplocalnow.com/us/washington-0 "
2016-07-25,403856596,Baltimore,"Bernie: ""if you think you can sit this election out, take a minute to think about the Supreme Court justices that Trump would nominate."""
2016-07-25,403856596,Baltimore,"Bernie: ""this election is about turning over citizens united."" #CitizensUnited #DemsInPhilly"
2016-07-25,81913437,"Washington, DC","""In this election, I'm with her."" -The First Lady about Hillary Clinton  http://toplocalnow.com/us/washington-0 "
2016-07-25,403856596,Baltimore,"Bernie: ""This election is not about any of the candidates"" but ""the needs of the American people and the kind of future we create."""
2016-07-25,28897188,"Washington, DC",This native Virginian is Kaine-ilicious! The Election #2016 puns are in full force at District…  https://www.instagram.com/p/BIThTN7DFXh/ 
2016-07-24,19123904,"Washington, DC20009","Garry Kasparov: Trump's a traitor, allowing Vladimir Putin to commit an Act of War by influencing our election  http://ow.ly/L66Q100fpTM "
2016-07-23,1617610868,"Washington, DC",WORLD HEALTH MEDICAL ALERT! 2016 PRESIDENTIAL ELECTION REGISTER 2VOTE NOW SO N NOV SIGN LAW PRESIDENT MICHELLE OBAMA pic.twitter.com/58oWh65bhD
2016-07-23,27573138,"Laurel, MD",When your plate says so about how you should feel about the upcoming election #trumpno…  https://www.instagram.com/p/BINajZajM2v/ 
2016-07-22,19123904,"Washington, DC20009","Wikileaks, backed by Putin, are attempting to influence our election by getting Trump elected President!  http://ow.ly/JlHh100fjWE "
2016-07-22,25439954,"Washington, DC",Throwback to celebrating Obama's election w Senator Tim Kaine. So excited that Virginia's own is…  https://www.instagram.com/p/BILwPHKjCmM/ 
2016-07-22,47242801,KCCO,Found who I'm endorsing this election. #FridgeFridays #Fridge16 #YesWeCan <Emoji: Flag of United States> @ United States…  https://www.instagram.com/p/BIKxKZkAHb1/ 
2016-07-21,32325287,LasVegas,"You have a 3rd choice this #election year. Vote #Edoc2016 when you hit the pills in #november.-""…  https://www.instagram.com/p/BIIW_yQgnCC/ "
2016-07-20,66179557,"Baltimore, MD","Dr.Darrell Scott: ""This election is one of the most crucial elections in American history"" RNCinCLE  http://foxbaltimore.com/news/election/live-republican-national-convention-kick-off …"
2016-07-20,98221214,"D[M]V-Brooklyn, NY","Cant wait for the day after the election. Hillary will be the next pres, but outing all the dumbasses supportig Trump will be glorious"
2016-07-18,33699884,Location:Nottelling!,Who needs gingerbread houses at Christmas time when you have White Houses during an election…  https://www.instagram.com/p/BIAmrBZASqs/ 
2016-07-17,891749113,Pennsylvania 🇺🇸-Dhahran 🇸🇦,@RegalMovies Late Check-in ★ The Purge: Election Year (with Leena at @regalmovies) — https://path.com/p/2krTwS 
2016-07-17,30222655,CapitolHill,Betcha #Pence backs out before Election Day #VP
2016-07-17,3887611992,,@matthewwalther Of the United States. Jill Stein is a fool too.  She won't crack 3 percent on election day.  President Hillary Clinton!
2016-07-15,93522847,"Inourhouse, MD","@AMCTheatres I'm at AMC Owings Mills 17 - @amctheatres for The Purge: Election Year in Owings Mills, MD https://www.swarmapp.com/c/euvz7MC2mLd "
2016-07-15,192722500,"Cartago, CostaRica","@RegalMovies The Purge <Emoji: Skull><Emoji: Skull><Emoji: Skull> (@ Regal Cinemas Rockville Center 13 - @regalmovies for The Purge: Election Year in Rockville, MD) https://www.swarmapp.com/c/iEAIbdolpQf "
2016-07-14,431242238,MarshallUniversity'19~OH,"Leadership is not about the next election, it's about the next…  https://www.instagram.com/p/BH2aH7dDUIySTRHrDEzFF3IuVdrva5AWjEdvtI0/ …"
2016-07-14,125860163,BuenosAires,#election #vote #republicans #democrats #history #politics #usa #advertising #politicalart @…  https://www.instagram.com/p/BH2SrC5DAep/ 
2016-07-12,57544155,"Philadelphia, PA","""This election, let's send a clear message: In America, we don't tear each other down; we lift…  https://www.instagram.com/p/BHyPxgyjoQ3/ "
2016-07-11,29798993,WashingtonDC,@JohnKingCNN #insidepolitics at #cnn with @johnkingcnn Fun night of question during this election year at the…  https://www.instagram.com/p/BHvdGfrhGG2/ 
2016-07-10,346748843,D(M)V,"@RegalMovies I'm at Regal Cinemas Majestic 20 & IMAX - @regalmovies for The Purge: Election Year in Silver Spring, MD  https://www.swarmapp.com/c/7YCRrwTWZBb "
2016-07-08,3061893893,MD/DC/VAWilltravel,<Emoji: Flag of United States> CALL TO ACTION | We want to work w non-profits this election to bring change. Please connect & #RT #acreativedc pic.twitter.com/ucKXo6AtEw
2016-07-07,22021863,TheNation'sCap,"@RegalMovies I'm at Regal Cinemas Hyattsville Royale 14 - @regalmovies for The Purge: Election Year in Hyattsville, MD https://www.swarmapp.com/c/2DCuUI7YBTC "
2016-07-06,15264536,"Washington, DC","Can we just skip this election <Emoji: Thinking face> #damontheagent #vote2016 #badcandidates @ Washington, District…  https://www.instagram.com/p/BHhhF0Jh_sw/ "
2016-07-03,17684177,Inmyhead,"@RegalMovies I'm at Regal Cinemas Gallery Place 14 - @regalmovies for The Purge: Election Year in Washington, DC https://www.swarmapp.com/c/ijeX66m2Yqa "
2016-07-03,19250934,"Baltimore, MD","@RegalMovies I'm at Regal Cinemas Hunt Valley 12 - @regalmovies for The Purge: Election Year in Hunt Valley, MD  https://www.swarmapp.com/c/jHz8z7wWdIr "
2016-07-03,429469101,,"@AMCTheatres Movie number 2 (@ AMC Owings Mills 17 - @amctheatres for The Purge: Election Year in Owings Mills, MD) https://www.swarmapp.com/c/7PwRoRZsxCN "
2016-07-03,5476822,"Washington, D.C.",Defy... Defy... Defy...#streetart #UStreet #dc #election @ U Street Corridor  https://www.instagram.com/p/BHZ_ZLhAtjU/ 
2016-07-03,75126494,WholesomeTwitter,"@RegalMovies I'm at Regal Cinemas Laurel Towne Centre 12 - @regalmovies for The Purge: Election Year in Laurel, MD  https://www.swarmapp.com/c/kW8Kiw5tRyO "
2016-07-03,199960442,"Chattanooga, TN","Please don't be Trump, Please don't be Trump #election2016 The #smithsonian celebrating election…  https://www.instagram.com/p/BHZbGHyhWdw/ "
2016-07-02,19375615,,"@AMCTheatres I'm at AMC Loews White Marsh 16 - @amctheatres for The Purge: Election Year in Baltimore, MD https://www.swarmapp.com/c/3smNRdUhVtU "
2016-07-02,66179557,"Baltimore, MD",Polls close as Australians vote in election cliffhanger  http://dlvr.it/Lj80pF 
2016-07-01,1420585104,Earth,Political art. I know my vote will count this election! #politics #vote #art @ National Museum…  https://www.instagram.com/p/BHVSuHbjHzs/ 
2016-06-29,35112452,WashingtonDC,And Donald Duck is in the lead...#donaldtrump #donaldduck #election #bethesdabagels #dupont @…  https://www.instagram.com/p/BHPt6LWD3hk/ 
2016-06-28,4921122977,,Good morning! Lively debate @ UPCEA Online Summit: How will the national election impact higher ed? #SOL16 pic.twitter.com/77XLvRut0T
2016-06-27,40687730,"FortLauderdale, FL",Election is over. POTUS @radrc Ran on a platform of hamburgers. #DC @ The White House  https://www.instagram.com/p/BHLRt3KguwE/ 
2016-06-24,1587583508,"Atlanta, Georgia","Excited to see Jake Sullivan, top foreign policy advisor to Hillary Clinton's 2016 election campaign. #trucon16 pic.twitter.com/CylctRNQPy"
2016-06-24,608243816,"Washington, DC",Obama lost another election with his #Brexit endorsement.  So he must have endorsed Hillary because he hates her
2016-06-24,81913437,"Washington, DC",Sen. Bernie Sanders says he's voting for Hillary Clinton in the 2016 Election. (AP Photo/Wilfredo Lee) @ABC7News  http://toplocalnow.com/united-states/district-columbia/washington …
2016-06-23,3297844962,"Washington, DC","@NylonMag only 1,595 days until november 3 2020 (the NEXT-next presidential election) <Emoji: Squared sos><Emoji: Flag of United States><Emoji: Smiling face with open mouth and cold sweat>@nylonmag tumblr…  https://www.instagram.com/p/BG_qvc3AUrC/ "
2016-06-22,344127226,,This election is @ faith in govt or enterprise. We voters will weigh the flaws of govt @HillaryClinton with flaws in biz @realDonaldTrump
2016-06-20,604003531,"Fredericton, NewBrunswick",Looking forward to tomorrow's discussion on election reporting with @SusanPage @abbydphillip @jmsummers #FreeSpirit16
2016-06-17,160037483,"Miami, FL",Not sure who to vote for this election? Write my name on the ballot and I'll do what needs to be…  https://www.instagram.com/p/BGyAIIuGfRp/ 
2016-06-17,51738938,"Edgewood, KY",I'd like to officially announce my bid for entering the 2016 presidential election as part of an…  https://www.instagram.com/p/BGxaAhnKcLV/ 
2016-06-15,15322509,"ÜT:32.851583, -96.646271",Ed Goeas giving an election update at Hike the Hill. Interesting! @ Phoenix Park Hotel  https://www.instagram.com/p/BGrf5WGTbvV/ 
2016-06-15,81913437,"Washington, DC",ELECTION NIGHT: From Gray's huge win to a Ward 8 upset to maybe the end of Vincent Orange http://www.washingtoncitypaper.com/news/loose-lips/blog/20782587/bowsers-council-bloc-on-the-line-on-election-night …
2016-06-15,15613754,"Washington, DC","One day election working, next day working to secure peace. #2050peace #worldin2050 @…  https://www.instagram.com/p/BGrQlOjGqkT/ "
2016-06-14,285338269,"Washington, DC","The sun is setting on another DC Primary Election. Gorgeous day, and confident of a big…  https://www.instagram.com/p/BGp2fEkmRTL/ "
2016-06-14,62041660,"CapitolHill, Washington, DC",Happy Flag/Election DC! #vote #election2016 #dc #ivoted @ Hill's Kitchen  https://www.instagram.com/p/BGpUT0-lad-/ 
