date,user_id,location,tweet
2016-08-22,346769869,"Lisburn, NorthernIreland",Which T-Shirt should I buy? #election #trump #clinton #president #usa @ America!  https://www.instagram.com/p/BJbdGFIA5NV/ 
2016-08-22,41599418,"NewYork, NY",Make your voice heard this - and every - election year. Register to vote! <Emoji: Flag of United States>This message is…  https://www.instagram.com/p/BJa7Sn4BNH2/ 
2016-08-22,130277202,"Norman, OK",How the 2016 Presidential Election Could Impact Healthcare http://www.ebainsure.com/featured-communications/2016/8/22/how-the-2016-presidential-election-could-impact-healthcare …
2016-08-21,14621253,NewYork,"""SELECTION ELECTION"" #summerstreettheatre #summerinthecity theater_for_the_new_city…  https://www.instagram.com/p/BJYK7pAjKOl/ "
2016-08-21,14621253,NewYork,"""Selection Election"" #summerstreettheatre theater_for_the_new_city #newyork_instagram #nyc…  https://www.instagram.com/p/BJYKYnnDg4w/ "
2016-08-20,53932318,NewYork,Tomorrow’s front page:I’M GONNA LOSE SO GOOD!Trump’s moves prove he WANTS to tank election  http://nydn.us/2bm8dfq 
2016-08-20,26887053,LosAngeles,Is the Pending Election Affecting Jobs for America? http://www.dianewaderecruiting.com/new-blog/2016/8/20/is-the-pending-election-affecting-jobs-for-america …
2016-08-20,104714715,"NewYork, USA",S07785 [Passed] Relates to the election of trustees and the adoption of an annual budget of the Poughkeepsie publ...  http://bitly.com/WRlHlx 
2016-08-19,44188562,NewYorkCity,Most important election in a #generation. Make sure you are…  https://www.instagram.com/p/BJTLAaZhxgMlUTSu9pPlHvjC8Nw3qjRjwggSBQ0/ …
2016-08-19,477269270,"Plattsburgh, NY, USA",Election Activities Update http://disabilitythinking.com/disabilitythinking/2016/8/19/election-activities-update …
2016-08-19,950531,NYC,Donald Trump's general election ad is here! It seems to be targeting Republicans. http://j.mp/2bD6QYv 
2016-08-19,30222655,CapitolHill,"This election season makes for some strange bedfellows       - me, non-ironically RTing @BillKristol again #Shakespeare"
2016-08-18,2008,NYCviaCMH,I took Donald Trump's advice and signed up to be an election worker.…  https://www.instagram.com/p/BJQLYnqAN79-SUcfNefluwOpZEGsW_AtvmyVd00/ …
2016-08-17,291726781,NewJersey/newyork,this election is like being in Disney land on bad acid #Fontaine<Emoji: Person raising both hands in celebration (medium skin tone)> @…  https://www.instagram.com/p/BJOK2j0h-GGGlhquQ_-BkGpxyQNsB2DBw0dNhM0/ …
2016-08-16,23897730,NewYorkCity,"Cardi has hot takes on the Olympics, the election, & black girl magic #blitz2016 @ Stage 48  https://www.instagram.com/p/BJMX0S2jKuv/ "
2016-08-15,53932318,NewYork,"Vice President Biden: Clinton's election ""will prove my daughter and my granddaughters can do anything my sons and… http://abcn.ws/2btKJno "
2016-08-14,480499822,"Verona, NJ",@vugarry he's worried about election fraud. It is a real stretch to believe he would try to prevent registered voters from voting
2016-08-14,53932318,NewYork,Donald Trump: “Help me stop Crooked Hillary from rigging this election!” http://nyp.st/2aScfIV 
2016-08-14,15791329,"NewYork, USA",The cover seems so much about the struggle for right and wrong.   The Election  seems to be…  https://www.instagram.com/p/BJGf9RKgV-J/ 
2016-08-14,53932318,NewYork,NOW: ABC News News' race rankings give Hillary Clinton 275 electoral votes if the election were held today.…  http://toplocalnow.com/us/new-york-city …
2016-08-13,34661669,NewYorkCity,"For most people, said than done! #vote #election #president #democrat #republican #politics…  https://www.instagram.com/p/BJESzTYAijB/ "
2016-08-13,70887240,,@CNN how can an election be rigged when it has not taken place yet. This is proof that Trump is a coo-coo bird. Please up his dosage.
2016-08-11,42784774,"NewYork, NY","Amidst all the vitriol and all the ugliness of this election cycle,…  https://www.instagram.com/p/BAdsy14ErlKysBMWRM6GPCoomELbag-UYAz3xc0/ …"
2016-08-11,320336872,,#Stephen_Colbert Will Host a Live Election-Night Comedy Special for #Showtime—Probably  http://dlvr.it/M1Bzdj  #marketing
2016-08-11,25126903,,How Donald Trump Just Lost the Election   http://www.nosquareinch.com/blog/2016/8/11/how-donald-trump-just-lost-the-election …
2016-08-11,10449,BrooklyntotheBay,If Trump keeps attacking him like this then Obama just might lose this election
2016-08-11,14348043,"NY, NY","<Emoji: Doughnut> Lovers for Hillary. 89 days to go until Election Day, download the…  https://www.instagram.com/p/BI90ZGFgGSz3Hd-nxXoKcmVWqB4R_pDz0EtMvg0/ …"
2016-08-10,86918777,NewYork,You know it's the election period when people stop to watch Hilary's speech on the street…  https://www.instagram.com/p/BI81eVphCbQ/ 
2016-08-10,67796451,"TomsRiver, NJ",Can this election get any crazier? Guy is climbing #trumptowers democrat? Lol @ Trump Tower 5Th…  https://www.instagram.com/p/BI8XpBqjbVu/ 
2016-08-10,720501042744594432,"Manhattan, NY","@SallyAlbright Attendees shld've asked Trump if he's familiar w/Ossining, as that's where he's going post-election. #LockHimUp"
2016-08-10,950531,NYC,I debunked (or re-debunked) eight myths about the election. http://j.mp/2aMa6Eh 
2016-08-10,44783957,"NewYork, NY","@realDonaldTrump Election lost to Hillary, weakest candidate in memory, because @realdonaldtrump is no opposition  http://www.bloomberg.com/news/articles/2016-08-10/what-trump-gets-wrong-about-clinton-and-the-second-amendment …"
2016-08-10,44783957,"NewYork, NY",@realDonaldTrump @realdonaldtrump doesn’t understand 2nd Amendment…Election lost to weakest candidate in memory because no opposition  http://www.bloomberg.com/news/articles/2016-08-10/what-trump-gets-wrong-about-clinton-and-the-second-amendment …
2016-08-09,337663433,NYC,Congratulations to our good friend @davidjtubiolo for winning the election for Westchester…  https://www.instagram.com/p/BI6XCeAhEzQ/ 
2016-08-09,950531,NYC,The honest-to-God ranking of campaign spending on gen election TV ads:1. Clinton2. Stein3. Johnson4. Trump http://j.mp/2aJPNDf 
2016-08-08,1265456449,"NewYork, NY",mcmanusnyc wins the sandwich election @ Peter McManus Cafe  https://www.instagram.com/p/BI2Ssh7B5Mm/ 
2016-08-07,15869051,Hawkguy'sBrooklyn,Taking a break from election news to watch a less frightening future of American politics. @…  https://www.instagram.com/p/BI00MHUjaQT/ 
2016-08-07,53932318,NewYork,"With his poll numbers plummeting, Trump says he's “afraid the election’s going to be rigged” pic.twitter.com/ID6seJ0HGd"
2016-08-07,14621253,NewYork,"""Selection Election"" #theaterforthenewcity #summerstreettheatre #nyc #newyork_instagram…  https://www.instagram.com/p/BIzz6TPjEj0/ "
2016-08-07,14621253,NewYork,"""Selection Election"" #theaterforthenewcity #summerstreettheatre #nyc #newyork_instagram…  https://www.instagram.com/p/BIzzFIGjTcz/ "
2016-08-06,329355754,NYC,"DT says, today the election in November is rigged? So of he wins in Nov that also will be rigged? #baffled Things that make you go, hmmmm"
2016-08-06,151364642,"Brooklyn, NY",The only question left is how bad the ass-kicking he takes will be on Election Day. https://twitter.com/KeithOlbermann/status/761943562288263168 …
2016-08-05,14411403,"NewYork, NY","Tomgram: Andrew Bacevich, Pseudo-Election 2016  http://bit.ly/2aH7IZT "
2016-08-05,1639439790,NewYork,@drgarynull PLEASE listen to Gary Null's show today for thoughts on the election of 2016. Be a Steward.
2016-08-05,20802396,Brooklyn,"@MichaelSteele What the heck is wrong with @michaelsteele is he serious? ""We want to win an election!"" These republicans are ready to sink this country!"
2016-08-04,17583309,"Brooklyn, NY","Training Poll Workers for Election Day (@ Bay Ridge Towers in Brooklyn, NY)  https://www.swarmapp.com/c/8Rnhfrodrky "
2016-08-04,53932318,NewYork,Here's what would happen if Donald Trump dropped out before election day pic.twitter.com/Lu02rX1pbQ
2016-08-03,17488879,Dena/YayArea/BKNY/Worldwide,@missfree would slay The Combover in an election. Better jawline. Better hair. And a MUCH…  https://www.instagram.com/p/BIqf133Dowf/ 
2016-08-03,950531,NYC,It's worth noting that scale alone makes rigging a presidential election a lot harder than it seems. http://j.mp/2aU5qbP 
2016-08-03,2412944347,NYC,The words #death #doom & #destruction come to mind this presidential #election #hillaryclinton…  https://www.instagram.com/p/BIqBIguh77B/ 
2016-08-03,2412944347,NYC,The words #death #doom & #destruction come to mind this presidential #election #hillaryclinton…  https://www.instagram.com/p/BIqBAT5hPIN/ 
2016-08-03,2412944347,NYC,The words #death #doom & #destruction come to mind this presidential #election #hillaryclinton…  https://www.instagram.com/p/BIqAsbABxav/ 
2016-08-03,2412944347,NYC,The words #death #doom & #destruction come to mind this presidential #election #hillaryclinton…  https://www.instagram.com/p/BIqAiw8BeD1/ 
2016-08-03,2412944347,NYC,The words #death #doom & #destruction come to mind this presidential #election #hillaryclinton…  https://www.instagram.com/p/BIqAVkRhtZb/ 
2016-08-03,2412944347,NYC,The words #death #doom & #destruction come to mind this presidential #election #hillaryclinton…  https://www.instagram.com/p/BIqAMUJBDO-/ 
2016-08-03,2412944347,NYC,The war of words is fierce this presidential #election between #hillaryclinton & #donaldtrump…  https://www.instagram.com/p/BIpl_ruBhbg/ 
2016-08-03,2412944347,NYC,The war of words is fierce this presidential #election between #hillaryclinton & #donaldtrump…  https://www.instagram.com/p/BIpk2rcBGXD/ 
2016-08-03,2412944347,NYC,The war of words is fierce this presidential #election between #hillaryclinton & #donaldtrump…  https://www.instagram.com/p/BIpkjwIBFom/ 
2016-08-03,950531,NYC,Trump has wasted most of the 91 days since he became the presumptive nominee. There are 97 days until the election. http://j.mp/2axwbUz 
2016-08-02,2853781,"Denver, CO",As if any night within this election cycle isn't a good night for a…  https://www.instagram.com/p/BIoFyT5AwOHek0Z17V9bBiyaz5-A4ZgXt2rDZk0/ …
2016-08-02,279316825,NewJersey,Is the 2016 Election Stressing You Out?   http://www.themindfulfamily.com/blog/2016/8/2/is-the-2016-election-stressing-you-out …
2016-08-02,950531,NYC,"On election night 2012, Donald Trump claimed the election was rigged against Romney.  http://j.mp/2axE4qo "
2016-08-02,188092633,"Brooklyn, NewYorkCity",The New Consumer Survey Contains a Big Hint That Clinton Will Win the Election  http://klou.tt/yundor96j9sh  #PersonalFinance
2016-08-01,876967490,Everywhere,New post! #AHOLE The Presidential Election Is Not For You   http://www.etiquetteforaholes.com/blog/2016/8/1/the-presid …
2016-08-01,53932318,NewYork,Hillary Clinton is now leading Donald Trump 46%-39% in a new general election poll  http://nydn.us/2aq5UHm 
2016-08-01,281815704,,It's been so hilarious to see how anti-with the shits the entire Bush family has been during this election season.
2016-07-31,14411403,"NewYork, NY",Trump and Clinton deserve each other in this stinking election  http://bit.ly/2aqIlhH 
2016-07-31,155603555,"Boston, Massachusetts",In case anyone was curious of my stance on the upcoming election... #fucktrump #fucktrump2016…  https://www.instagram.com/p/BIiqucAhOdX/ 
2016-07-30,16190278,"Brooklyn, NY",Weekend read -- a book of essays that came out before the 2008 election. Edited Susan Morrison…  https://www.instagram.com/p/BIfYI95Ad_i/ 
2016-07-29,42329578,"NewJersey, USA","@AMCTheatres Cine <Emoji: Man and woman holding hands><Emoji: Heavy red heart> (@ AMC Aviation 12 - @amctheatres for The Purge: Election Year in Linden, NJ)  https://www.swarmapp.com/c/7GUn3YEhrsX "
2016-07-29,1214451157,"NewYork, NY",I'm with Her! #orlando #dnc #philly #hillaryclinton #election #danceonthepier #pierdance…  https://www.instagram.com/p/BId1jdVDoEP/ 
2016-07-29,36743313,"NewYork, NY","Don't end up like this after the election, be sure to vote! Watch the full video here:…  https://www.instagram.com/p/BId0oYYjNJN/ "
2016-07-29,294286695,,"""Finally DJ Jazzy Jeff is being interviewed on @CNN and can tell us his view on this election"" -nobody"
2016-07-28,758391262697361408,,Hailey will win this election pic.twitter.com/X5G84XfRK2
2016-07-28,758391262697361408,,127 days to go till Hailey win 2016 election
2016-07-28,20162446,"ÜT:40.75629, -73.986556","as upsetting and baffling as this election has been (and continues to be), this is…  https://www.instagram.com/p/BIbfLNvgg_K/ "
2016-07-28,781491312,"NewYork, NewYork",Chris Mathews: the democrats have made this a values election-- they've embraced it with exuberance they never have before #DemsInPhilly
2016-07-28,51078110,NewYork,This is exactly what I think about this Election @ Bryant Park  https://www.instagram.com/p/BIacT85g1uC-QnngqQGgxW5mgOV2kxmuaVdCXc0/ …
2016-07-28,950531,NYC,did you know that this is the most important election of our lives http://j.mp/2akvOJZ 
2016-07-27,152509384,,Need to psychic to tell me the outcome of this election..
2016-07-27,53932318,NewYork,"""Democracy works, America. But we gotta want it – not just during an election year, but all the days in between.""…  http://toplocalnow.com/us/new-york-city …"
2016-07-27,781491312,"NewYork, NewYork",People outside of the US do not understand what is going on in this election.- @BarackObama #DemsInPhilly
2016-07-27,781491312,"NewYork, NewYork","""This is not your typical election. It is about who we are as a people -- @BarackObama #DemsInPhilly"
2016-07-27,781491312,"NewYork, NewYork","""This election is not about democratic or republican parties, but which candidate is the better leader now."" - @MikeBloomberg #DemsInPhilly"
2016-07-27,3338364609,"Columbus, OH",Who's with me? This election let's vote Hillary Clinton for prison. @ Tag a Friend  https://www.instagram.com/p/BIX6LO3AamU/ 
2016-07-27,83665753,NewYorkCity,"The Ripple Affection company is voting for You - Tuesdays through the election. @ Times Square,…  https://www.instagram.com/p/BIXqRaMj5-J/ "
2016-07-26,281815704,,I'll be so glad when this election is over because I'm so close to blocking the whole lot of you.
2016-07-25,781491312,"NewYork, NewYork",This election is about moving toward universal healthcare -- @BernieSanders #DemsInPhilly
2016-07-25,781491312,"NewYork, NewYork",This election is about climate change -- @BernieSanders #DemsInPhilly
2016-07-25,781491312,"NewYork, NewYork","""This election is about the needs of the American people & the future we want for our children & grandchildren "" -@SenSanders #DemsInPhilly"
2016-07-25,53932318,NewYork,"""When [Hillary] didn't win the election 8 years ago, she didn't get angry or disillusioned"" DemsInPhilly  http://toplocalnow.com/us/new-york-city …"
2016-07-25,950531,NYC,Sanders's former press secretary reminds his supporters that the election was not stolen. http://j.mp/2acRb2A 
2016-07-25,322318164,LondonMargateLeipzig,Well that is one way to do it! #nyc #streetphotography #trump #election #usa #newyork #streets…  https://www.instagram.com/p/BITGeBcgXHD/ 
2016-07-24,2412944347,NYC,The war of words is fierce this presidential #election between #hillaryclinton & #donaldtrump…  https://www.instagram.com/p/BIRGa7HBzpo/ 
2016-07-24,2412944347,NYC,The war of words is fierce this presidential #election between #hillaryclinton & #donaldtrump…  https://www.instagram.com/p/BIRGFJlBUlC/ 
2016-07-24,2412944347,NYC,The war of words is fierce this presidential #election between #hillaryclinton & #donaldtrump…  https://www.instagram.com/p/BIRFf2SBJOE/ 
2016-07-24,31276003,"SouthPlainfield, NJ",I just want this election to be over already
2016-07-23,5867132,t@tarah.org,My BFF @ElissaBeth killed it yesterday w her talk on censorship in social media during this election! #hopeconf pic.twitter.com/wf5mAwmX4b
2016-07-23,950531,NYC,Tim Kaine isn't going to hand the election to Clinton. http://j.mp/2alycSj 
2016-07-22,18817081,,Win Butler of arcadefireband just made an election prognostication from stage at panoramanyc…  https://www.instagram.com/p/BIL76yhjZGW/ 
2016-07-22,71249976,"NewYork, NY","@AMCTheatres I'm at AMC Empire 25 - @amctheatres for The Purge: Election Year in New York, NY https://www.swarmapp.com/c/1YXQbqb0Uyc "
2016-07-22,104714715,"NewYork, USA","S06228 [Passed] Extends, for an additional 4 years, the provisions of Lauren's law, providing for the election to... http://bitly.com/WvuVDO "
2016-07-21,53932318,NewYork,"Well, finally, it's over. (The RNCinCLE, there's still 110 days till the election) pic.twitter.com/uU2RlCoVlL"
2016-07-21,64141011,"Brooklyn, NewYork",One of the core things of this election RT @Acosta: That SCOTUS line got the loudest applause so far
2016-07-21,104714715,"NewYork, USA",A03330 [Passed] Repeals provisions of the election law relating to election inspectors and clerks.  http://bitly.com/Y3Xbfc 
2016-07-21,1146698718,,"What an honor to host Congressional candidate Anna Throne-Holst, whose election from the east…  https://www.instagram.com/p/BIH3J1WgsSL/ "
2016-07-20,53932318,NewYork,"Newt Gingrich: ""In this election there is only one candidate who will uphold the Constitution."" RNCinCLE  http://toplocalnow.com/us/new-york-city …"
2016-07-20,101897996,TrinidadandTobago ✈️NewYork,"@AMCTheatres I'm at AMC Fresh Meadows 7 - @amctheatres for The Purge: Election Year in Fresh Meadows, NY https://www.swarmapp.com/c/59LHnpIpcvg "
2016-07-20,2412944347,NYC,The war of words is fierce this presidential #election between #hillaryclinton & #donaldtrump…  https://www.instagram.com/p/BIGuxTkgsHd/ 
2016-07-20,2412944347,NYC,The war of words is fierce this presidential #election between #hillaryclinton & #donaldtrump…  https://www.instagram.com/p/BIGuoL1gT8o/ 
2016-07-20,2412944347,NYC,The war of words is fierce this presidential #election between #hillaryclinton & #donaldtrump…  https://www.instagram.com/p/BIGt5d3AgNz/ 
2016-07-20,49984438,"ÜT:40.734437, -74.001048",Not quite sure what this is but ok! #gop #election #pigs @ Washington Square Park  https://www.instagram.com/p/BIGj9Ykg9TY/ 
2016-07-20,87578311,"NewYork, USA",Dudes out here collecting opinions of 2016's election cycle from his cycle. #dangerousWork check…  https://www.instagram.com/p/BIGhqfejDxL/ 
2016-07-20,1012650391,"LosAngeles, CA",As we move full force into the U.S. Election season....  Please keep these fine words in mind…  https://www.instagram.com/p/BIGOznWAIE4/ 
2016-07-20,52451507,"Brooklyn, NYC",This election has been a circus. So why not? Trump is the ringmaster and here's his clowns.…  https://www.instagram.com/p/BIFkG5QhAzX/ 
2016-07-19,3009281573,"Bronx, NY ✖️ ✈️","Make America Great.....Again <Emoji: Unamused face><Emoji: Flag of United States> #RNC2016 #America #Election #NYC @ 5th Avenue, New York City  https://www.instagram.com/p/BIEHke-jYQX/ "
2016-07-19,15914864,"41.046964, -73.812081","@AMCTheatres I'm at AMC Empire 25 - @amctheatres for The Purge: Election Year in New York, NY  https://www.swarmapp.com/c/8uroGy3B07a "
2016-07-19,2278384804,"SaintStephen, SouthCarolina",For real I have not laughed so hard this entire election until early…  https://www.instagram.com/p/BIC1hsBjufwDbP6HKoXGbWwZ2LZTx_5HtC3Oq80/ …
2016-07-19,25745158,NYC,If you didn't think this election was a joke then last night was just the cherry on top. Make…  https://www.instagram.com/p/BICmP8BhbYJ/ 
2016-07-18,151364642,"Brooklyn, NY","#RNCinCLE If it wasn't a completely ludicrous idea, I'd think Trump & friends are actively trying to throw this election."
2016-07-18,2412944347,NYC,The war of words is fierce this presidential #election between #hillaryclinton & #donaldtrump…  https://www.instagram.com/p/BIBzrDuBmCn/ 
2016-07-18,2412944347,NYC,The war of words is fierce this presidential #election between #hillaryclinton & #donaldtrump…  https://www.instagram.com/p/BIBzh1LBbpw/ 
2016-07-18,2412944347,NYC,The war of words is fierce this presidential #election between #hillaryclinton & #donaldtrump…  https://www.instagram.com/p/BIBy0o5h63V/ 
2016-07-18,2412944347,NYC,The #war of words is fierce this #presidential #election between #hillaryclinton & #donaldtrump…  https://www.instagram.com/p/BIByZFZBw37/ 
2016-07-18,10796562,"Brooklyn, NY","Welp this is it guys, The Last Election"
2016-07-15,393092178,Philly,"@RegalMovies I'm at Regal Cinemas Atlas Park 8 - @regalmovies for The Purge: Election Year in Glendale, NY https://www.swarmapp.com/c/1ssExgHqh9w "
2016-07-15,25700178,"Charlotte, NC",Takeover at the Election Booth begins October 27 http://www.takeoverfriday.com/events/2016/10/27/takeover-at-the-election-booth-begins-october-27 …
2016-07-14,104714715,"NewYork, USA","S06228 [Enroll] Extends, for an additional 4 years, the provisions of Lauren's law, providing for the election to... http://bitly.com/WvuVDO "
2016-07-14,18766459,WorkingonabookwithRakim,“Political scientists generally don’t think running mates have much of an effect on election results.” -Larry Sabado
2016-07-13,281815704,,This is seriously about to be the most trash ass election in American history.
2016-07-13,242039824,"LasVegas, NV","Can we place gaggles of pikachus in voting booths on Election Day? #PokemonGo (yes, I looked up how to spell pikachu (sigh))"
2016-07-13,104714715,"NewYork, USA",A03330 [Enroll] Repeals provisions of the election law relating to election inspectors and clerks.  http://bitly.com/Y3Xbfc 
2016-07-13,14545416,NorthernNJ,Either Trump can't handle success or he's actively working to throw the election.  http://bigstory.ap.org/article/b20e46f3a0954d858d940bcb0b183f4c/trump-seeks-10-million-former-aide-disclosure-case …
2016-07-13,477269270,"Plattsburgh, NY, USA",Election Blogging Update   http://disabilitythinking.com/disabilitythinking/2016/7/13/election-blogging-update …
2016-07-13,61139664,"Queens, NY","@AMCTheatres <Emoji: Dizzy face><Emoji: Flag of United States> (@ AMC Loews 34th Street 14 - @amctheatres for The Purge: Election Year in New York, NY)  https://www.swarmapp.com/c/6N5L7dLSdes "
2016-07-13,34101380,BrooklynNY,"@TheView @JedediahBila @candacecbure @ravensymone for next election, u wait weeks before the convention to push this #smdh"
2016-07-13,34101380,BrooklynNY,"@TheView @candacecbure @ravensymone @JedediahBila from the main two candidates, your 3rd party ppl can start working on next election"
2016-07-12,42465584,NewYorkCity,"@RegalMovies I'm at United Artists Midway 9 - @regalmovies for The Purge: Election Year in Forest Hills, NY https://www.swarmapp.com/c/2fl47M96nPP "
2016-07-11,28918980,"Greensboro, NC","Japan's Abe orders new stimulus after election win, as machinery orders 'stall' -…  http://dlvr.it/LmxQt5  #business pic.twitter.com/xc6xLmfVR2"
2016-07-11,48466186,,"@RegalMovies I'm at Regal Cinemas E-Walk 13 & RPX - @regalmovies for The Purge: Election Year in New York, NY https://www.swarmapp.com/c/8CK1vvr0spW "
2016-07-10,167949601,Switzerland,@RegalMovies The purge (@ Regal Cinemas E-Walk 13 & RPX - @regalmovies for The Purge: Election Year)  https://www.swarmapp.com/c/7lKbQhIBOeg  pic.twitter.com/ZvTr5l8lWm
2016-07-08,1237818019,,"@AMCTheatres Here again lol took myself out! (@ AMC Bay Plaza Cinema 13 - @amctheatres for The Purge: Election Year in Bronx, NY) https://www.swarmapp.com/c/2eN6nejd6UE "
2016-07-08,971433606,"Geraldton, WesternAustralia",Election 2016: Coalition to form government as more crossbenchers pledge support   http://www.everythinggeraldton.com.au/geraldton-news/2016/7/8/election-2016-coalition-to-form-government-as-more-crossbenchers-pledge-support …
2016-07-06,2558804523,,"@RegalMovies Purging with yummy (@ Regal Cinemas E-Walk 13 & RPX - @regalmovies for The Purge: Election Year in New York, NY) https://www.swarmapp.com/c/8xyzBP8YqVV "
2016-07-06,40387824,NYCandLA,"@RegalMovies I'm at United Artists Kaufman Astoria 14 - @regalmovies for The Purge: Election Year in Astoria, NY https://www.swarmapp.com/c/6hz5LoLYBDx "
2016-07-06,24675943,chilltownxjerseycityxnj,"I'm at Kerasotes Showplace 14 for The Purge: Election Year in Secaucus, NJ https://www.swarmapp.com/c/5tzbi2MeE1S "
2016-07-06,14411403,"NewYork, NY",Some Black Harlem Leaders Worried About Election of Dominican Congressman  http://bit.ly/29kYXnJ 
2016-07-04,3313218894,she/her,I was gonna say Sydney does fireworks better but looking at these election results I guess we…  https://www.instagram.com/p/BHd5_HpAtsS/ 
2016-07-04,20321703,NewYorkCity,"Coney Island. July 4, 2016. Election year profiteering. #happy4th<Emoji: Collision symbol><Emoji: Flag of United States> #nyc<Emoji: Statue of liberty> #i<Emoji: Heavy red heart>nyc…  https://www.instagram.com/p/BHd2-e3Dz7N/ "
2016-07-04,24848492,"NewYork, NY","Thought about the election today, so I'm digging my way to Canada. Bye, America! <Emoji: Waving hand sign (medium light skin tone)><Emoji: Waving hand sign (medium light skin tone)><Emoji: Waving hand sign (medium light skin tone)>…  https://www.instagram.com/p/BHdHtLajK0P/ "
2016-07-04,53100146,NewYorkCity,@RegalMovies The purge to celebrate July 4th (@ United Artists Kaufman Astoria 14 - @regalmovies for The Purge: Election Year)  https://www.swarmapp.com/c/efu3QcuNTaC 
2016-07-04,182033627,NJ,@AMCTheatres Seeing The Purge: Election Year (@ AMC Loews Mountainside 10 - @amctheatres for The Purge: Election Year)  https://www.swarmapp.com/c/6KNU3NhVlSH 
2016-07-03,28918980,"Greensboro, NC","Asian stocks recoup losses, Aussie wobbles on uncertain election - Reuters  http://dlvr.it/LjmvHp  #business pic.twitter.com/jBILf3Q0Wo"
2016-07-03,46772154,JerzGirl,@AMCTheatres I am officially Trump Presidency prepared... (@ AMC Aviation 12 - @amctheatres for The Purge: Election Year) https://www.swarmapp.com/c/12XdapYLn00 
