date,user_id,location,tweet
2017-04-06,710832920924041218,"Arkansas, USA",Election ballots are out! Don't forget to vote Brittany Jenkins for SGA Sophomore Prez! <Emoji: Electric light bulb>…  https://www.instagram.com/p/BSjRJZvgVh2/ 
2017-04-06,710832920924041218,"Arkansas, USA",Guess what day it is! Today is the day that the Lord has made! (It's also election day!) Make…  https://www.instagram.com/p/BSjEqEEAyp-/ 
2017-04-05,15988585,"OklahomaCity, OK",A wise man once said...never try to predict the outcome of an election or baseball game. I…  https://www.instagram.com/p/BShNESiD3n3/ 
2017-03-09,382924739,,The new chair of Precinct 195 and secretary of HD 87 fills out some post election paperwork. I…  https://www.instagram.com/p/BRcOq7jg4AB/ 
2017-03-09,104729708,"Oklahoma, USA",SB146 [Engross] Elections; procedures for payment of election costs. Effective date. http://bitly.com/UyBukw 
2017-04-06,710832920924041218,"Arkansas, USA",Election ballots are out! Don't forget to vote Brittany Jenkins for SGA Sophomore Prez! <Emoji: Electric light bulb>…  https://www.instagram.com/p/BSjRJZvgVh2/ 
2017-04-06,710832920924041218,"Arkansas, USA",Guess what day it is! Today is the day that the Lord has made! (It's also election day!) Make…  https://www.instagram.com/p/BSjEqEEAyp-/ 
2017-04-05,15988585,"OklahomaCity, OK",A wise man once said...never try to predict the outcome of an election or baseball game. I…  https://www.instagram.com/p/BShNESiD3n3/ 
2017-03-09,382924739,,The new chair of Precinct 195 and secretary of HD 87 fills out some post election paperwork. I…  https://www.instagram.com/p/BRcOq7jg4AB/ 
2017-03-09,104729708,"Oklahoma, USA",SB146 [Engross] Elections; procedures for payment of election costs. Effective date. http://bitly.com/UyBukw 
2017-03-06,351404530,"OklahomaCity, OK","I was blessed to assist at the three ""Rites of Election"" yesterday afternoon/evening at Our…  https://www.instagram.com/p/BRS_Js5BBR-/ "
2017-02-14,1900484124,OklahomaCity,Happy Valentine Election Day! Love your country and get out and vote in your local election…  https://www.instagram.com/p/BQgH2qXgPxw/ 
2017-02-07,99557678,"OklahomaCity, OK","Bernie should've been the Democratic nominee, but he wasn't an option for the general election. I agree with this. https://twitter.com/LOLGOP/status/829052639065276416 …"
2017-02-02,104729708,"Oklahoma, USA",HB1616 [NEW] Elections; authorizing Secretary of the State Election Board to create pilot program for certain ele... http://bitly.com/VTMTzw 
2017-02-01,104729708,"Oklahoma, USA",SB597 [NEW] School employee organizations; requiring election to certify existing organization. Effective date. E... http://bitly.com/XIKTZn 
2017-01-31,104729708,"Oklahoma, USA",HB1762 [NEW] Elections; creating the Election Reform Act of 2017; effective date.  http://bitly.com/XKh9LH 
2017-01-29,104729708,"Oklahoma, USA",HB1761 [NEW] Elections; creating the Election Spending Reform Act; effective date. http://bitly.com/VWhWe9 
2017-01-29,104729708,"Oklahoma, USA",HB1753 [NEW] Elections; creating the Election Guidelines Act; effective date.  http://bitly.com/XMk7PQ 
2017-01-27,104729708,"Oklahoma, USA",SB348 [NEW] Voter registration; providing for voter registration on election days. Effective date. http://bitly.com/VHpMs2 
2017-01-25,104729708,"Oklahoma, USA",HB2220 [NEW] Elections; creating the Election Reform Act; effective date.  http://bitly.com/VVrMwE 
2017-01-23,104729708,"Oklahoma, USA",SB517 [NEW] Local government funding; authorizing county election for severance tax; providng procedure and appor...  http://bitly.com/VLGRB8 
2017-01-23,104729708,"Oklahoma, USA",SB449 [NEW] Counties and county officers; modifying election years. Emergency. http://bitly.com/XEMUpu 
2017-01-17,104729708,"Oklahoma, USA",SB200 [NEW] School district elections; changing date of election for certain levy. Effective date. http://bitly.com/WCOJjH 
2017-01-14,104729708,"Oklahoma, USA",HB1043 [NEW] State Election Board; appropriation; purpose; budgetary procedures; effective date. http://bitly.com/XAmEfO 
2017-01-13,104729708,"Oklahoma, USA",SB146 [NEW] Elections; modifying procedures for payment of election costs. Effective date. http://bitly.com/UyBukw 
2017-01-12,270513746,WorldwideUnderground.OKC,"Happy Thursday friends! If we have learned anything from this past election year,  it is that we…  https://www.instagram.com/p/BPKznIIgn7b/ "
2016-11-17,391506733,"Norman, OK",Election Watch Party 2016: we stole a rock then Trump stole the Hill…  https://www.instagram.com/p/BM7MKU3BohR-YSIXLyLq5K0H_3yZSvdpCEV1RQ0/ …
2016-11-11,20855958,"OklahomaCity, OK",After this election I thought I had finally seen all things ridiculous. Then I saw Thor riding…  https://www.instagram.com/p/BMrVeL0geq4/ 
2016-11-09,1222902937,"Asheville, NC|OKC","Ya'll all worried about the election, and im just tryna find another Nutella milkshake to share…  https://www.instagram.com/p/BMm_PD5gz5f/ "
2016-11-09,33825968,OKC,"For now, this is all I have to offer for those post-election blues: a funny baby on a bus.…  https://www.instagram.com/p/BMmd5Clh9tB/ "
2016-11-09,22299373,"OKC, OK",You gotta be quicker than that! lol #election #Hillary #killary #soglad #MakeAmericaDecentAgain…  https://www.instagram.com/p/BMl_8w6ju49/ 
2016-11-08,490471763,oklahomacity,No matter the election results... goals don't change..-Don't dwell in the shit we can't…  https://www.instagram.com/p/BMkM587D4YR/ 
2016-11-08,2661636039,OKC,Team #notallowedtovotebecauseforeignanddog waiting for Mom to do the voting #election #vote…  https://www.instagram.com/p/BMkBGNahoHm/ 
2016-11-08,109324949,,My moms took me to vote! <Emoji: Heavy red heart><Emoji: Flag of United States><Emoji: Victory hand (light skin tone)>                First election 2016! #sirwhitney #imwithher @…  https://www.instagram.com/p/BMj_3MzgDz3/ 
2016-11-08,768043339,"UCOCheer, MusicMajor",@UCOCheer Even on Election Day @ucocheer is still putting in work! Everyone…  https://www.instagram.com/p/BMj3s2SByLhNZcZPwkJtSX9I_bu92-rHF4IqHY0/ …
2016-11-08,39401924,"OklahomaCity, OK",Election Day. #obligatoryivotedselfie #ivoted #election2016<Emoji: Flag of United States>…  https://www.instagram.com/p/BMj0XAehimmYNgtYOCw_R892WJkTK6X4AcZ9MQ0/ …
2016-11-08,42504122,"OklahomaCity, OK",Gearing up for Election Party 2016. #DontBooVote #imwithher @…  https://www.instagram.com/p/BMjuzvsjtkm7qj1OZuQQAeTf3FfT9Md6doMSL00/ …
2016-11-08,88193157,"900EMainYukon, Oklahoma",Our new series could not fit more perfectly with today's election. Today is your ONE DAY to let…  https://www.instagram.com/p/BMjljc2hS4s/ 
2016-11-08,18059598,"Norman, OK","My brother hates selfies, but since it's Election Day he indulged me. Election breakfast...  https://www.swarmapp.com/c/3u2ERCqSTsA  pic.twitter.com/wcE6pVSjiL"
2016-11-08,381346378,"Atlanta, GA",#imwithHER #imwithher<Emoji: Flag of United States> #PERIOD Or I'm going back to <Emoji: Right pointing backhand index (medium dark skin tone)><Emoji: Flag of South Africa><Emoji: Flag of South Africa><Emoji: Flag of South Africa><Emoji: Flag of South Africa><Emoji: Flag of South Africa><Emoji: Flag of South Africa> @ Oklahoma State Election…  https://www.instagram.com/p/BMjY4d9DF1b/ 
2016-11-08,122551656,,Finnegan wants to wish you all a productive Election Day followed by lots of outside play time.…  https://www.instagram.com/p/BMjWZQ9BMun/ 
2016-11-08,7740622,"OklahomaCity, OK","Fred on Election Day. @ Cleveland UCD, Oklahoma City, Oklahoma  https://www.instagram.com/p/BMjWJ_elps3/ "
2016-11-08,7740622,"OklahomaCity, OK","Election Day oatmeal: cinnamon, blackberries, flax seeds, banana. @ Cleveland UCD, Oklahoma…  https://www.instagram.com/p/BMjS6uzFagA/ "
2016-11-08,35495845,OklahomaCity,Did it! This election has been gross but voting felt so good! #GoVote @ Surrey Hills Baptist Church  https://www.instagram.com/p/BMjQaN7gvIp/ 
2016-11-07,2480083698,UnitedStatesofAmerica,"During this #election America needs #relief for gas, bloating, and discomfort* from all the…  https://www.instagram.com/p/BMhNpUEjBYt/ "
2016-11-06,19827023,Oklahoma,"RT @dailystoic: ""Objectivity is a virtue, and one that is very difficult to practice."" Pierre Hadot #Election"
2016-11-05,2545636194,rightnexttoyou,My Saturday #morning#earlyvoting #ivoted #govote @ Oklahoma State Election Board  https://www.instagram.com/p/BMcO7tRj8Lr/ 
2016-11-05,350702558,"Norman, OK",It feels good to be an American <Emoji: Flag of United States><Emoji: Flag of United States> @ Oklahoma State Election Board  https://www.instagram.com/p/BMcMwaDAtrWSWyJvHUBzAm7peBLCQ2jwfZLFLY0/ …
2016-11-05,90096261,"OklahomaCity, OK",I voted. @ Oklahoma County Election Board  https://www.instagram.com/p/BMcLDxrDRZR/ 
2016-11-05,24741356,"OklahomaCity, OK, USA",I know you're busy. I know you've got a lot to do. I know it's 2 days till the election. I know…  https://www.instagram.com/p/BMcDqI_guSI/ 
2016-11-05,17011658,"Norman, Okla.",Long live the Republic. #vote #election2016 @ Cleveland County Election Board  https://www.instagram.com/p/BMb_hN9BylC/ 
2016-11-05,3267360409,"Guthrie, OK",I voted Go Trump @ Logan County Election Board  https://www.instagram.com/p/BMb_IGGDZPN/ 
2016-11-05,377407383,"Charlotte, NC/Waycross, GA",<Emoji: Flushed face><Emoji: Flushed face><Emoji: Flushed face> @ Oklahoma State Election Board  https://www.instagram.com/p/BMbt5NuhtdjldNpfQM4QHhNR_igKmZXJAGraeU0/ …
2016-11-05,243823230,OKC,Huge lines for early voting. @ Oklahoma State Election Board  https://www.instagram.com/p/BMbfsF6g0W6/ 
2016-11-04,211356320,,"Good god... (@ Oklahoma County Election Board in Oklahoma City, OK) https://www.swarmapp.com/c/cx6aJZ3Ih6Z "
2016-11-04,21005839,"Edmond, Oklahoma",Rock the Vote  <Emoji: Heavy check mark> @ Oklahoma State Election Board  https://www.instagram.com/p/BMZlIJeDH9Q/ 
2016-11-04,157706528,"norman, ok","From top to bottom: the line I am in, wrapping around the building, at the election board.…  https://www.instagram.com/p/BMZiYMajm-I/ "
2016-11-04,133483526,"DelCity, OK","I'm at Oklahoma County Election Board in Oklahoma City, OK https://www.swarmapp.com/c/4XZS1vxGvOC "
2016-11-04,15203570,"Dallas, TX",#earlyvoting here in #oklahomacity #oklahoma #okc #vote @ Oklahoma State Election Board  https://www.instagram.com/p/BMZcv6FgBki/ 
2016-11-04,15203570,"Dallas, TX",#EarlyVoting here in #OKC #vote @ Oklahoma State Election Board  https://www.instagram.com/p/BMZbpLvgQPq/ 
2016-11-04,76756675,"Edmond, Oklahoma","The stress of the election? Or our Fall Wine Sale? Whatever it was, this poor bottle cracked…  https://www.instagram.com/p/BMY93VmFHvh/ "
2016-11-03,193436623,"Yukon, OK","Why are we concerned about an election, when He holds all of this in his hand? #heisincontrol…  https://www.instagram.com/p/BMWG-QNgq51/ "
2016-10-29,2232134154,"128E.FifthSt.Edmond, OK",So we all know this election is SCARY! So tonight if you dress any any political figure and you…  https://www.instagram.com/p/BMJyhgLhbMW/ 
2016-10-28,344305586,OklahomaCity,I hope that the election goes as well as the Halloween door…  https://www.instagram.com/p/BMHhegTBVLX_u2URWz59752IrEM4hLbH3HQIE00/ …
2016-10-27,387209768,TheSettlerStateofAmerica,"Just dropped the latest Episode of ""Street Akademics"" on the Presidential Election and The…  https://www.instagram.com/p/BMEqMrkj0je/ "
2016-10-20,19050782,,"2017 GO Bond Kickoff Meeting. Election is in September, make sure you're informed. @ City of…  https://www.instagram.com/p/BLze07QD-ot/ "
2016-10-16,25418109,,Re: the election. Thank God we only have a few weeks to go and thank God that He is in control.…  https://www.instagram.com/p/BLoo7Esg7T8/ 
