date,user_id,location,tweet
2016-11-05,157593205,"Portland, Oregon","Got my Teddies, got my popcorn, and the First Movie is The Purge: Election Year. @ Casa Aguirre  https://www.instagram.com/p/BMc6e8eA5i9/ "
2016-11-05,17194342,Hollywood&N.MississippiPDX,a winning election still life featuring the cool #joesacco drawn comic for #pdx city council…  https://www.instagram.com/p/BMcnwZrDBtb/ 
2016-11-04,127567014,Oregon,"Are you anxious about #Nov8 #election? Let's build a spiritual firewall against national #anxiety, together.  http://ow.ly/iNVy305Slwn  Plz RT"
2016-11-02,2228210185,"Portland, OR",@ROCKETDRAG at least now we can hope it's an analogy for the election maybe.
2016-11-02,34143852,,"If only people cared about this election as much as they care about the ""green"" starbucks cup..."
2016-11-02,12007192,"Portland, Oregon",There. Finished with participation in arguably the worst election season since 1988.…  https://www.instagram.com/p/BMTI1BrBVdK/ 
2016-11-01,18943244,PortlandORUSA,It's only one week until election day. Vote. #vote #vote2016<Emoji: Flag of United States> #oregonrepublic #oregon @…  https://www.instagram.com/p/BMS5lczgRrB/ 
2016-11-01,69460754,"Portland, OR",Got our Trump piñata for next weeks election party!  Can't wait to beat this thing up!…  https://www.instagram.com/p/BMSL-6HDDIe/ 
2016-11-01,2228210185,"Portland, OR",Just fucking end the election already!
2016-11-01,844384723,PortlandOregon,"$1 election day oysters, gumbo flights and other November food events  http://dlvr.it/MZCy8Q  pic.twitter.com/uH7yZzlWbm"
2016-10-31,720807046602330113,"Portland, OR",ms.marca and I like to turn the tables on this election this Halloween year... <Emoji: Smiling face with horns><Emoji: See-no-evil monkey><Emoji: Smirking face> #shewins…  https://www.instagram.com/p/BMQR6_XjOMN/ 
2016-10-31,71897004,"LincolnCity, OR",Full Show - Hillary’s Plans To Rig Election Leaked - 10/31/2016  http://dlvr.it/MZ5XTc  pic.twitter.com/0gnpTKWxlr
2016-10-31,71897004,"LincolnCity, OR",Biggest Election Fraud In History Discovered In The United States: Breaking Now  http://dlvr.it/MZ1MK1  pic.twitter.com/UrZ2zJrUz1
2016-10-31,108574656,"portland, or",@cmhelstein and I dropping off our #votes #elections2016 #election…  https://www.instagram.com/p/BMPbjhQAzDTeGRJxoGAiZ_vbTI95qLP23I-cO40/ …
2016-10-30,71897004,"LincolnCity, OR",Election Fraud Smokescreen By New FBI Investigation: Special Report  http://dlvr.it/MYfG25  pic.twitter.com/YSnJQLqpOG
2016-10-28,2228210185,"Portland, OR","I am so fucking tired of this election. Just end it, end it now"
2016-10-28,4765141,"Portland, Oregon, USA",“Clinton had appeared to be cruising toward a dominant win in the election.”  https://www.bloomberg.com/news/articles/2016-10-28/fbi-is-re-opening-clinton-e-mail-investigation-chaffetz-says …
2016-10-26,71897004,"LincolnCity, OR",Expert: Trump has Already Won Election  http://dlvr.it/MXNTXB  pic.twitter.com/091koO3dBA
2016-10-24,7930732,"Portland, Oregon","have hope, people. the election will be over soon. (full rainbow over portland, 6 p.m.,…  https://www.instagram.com/p/BL933pFh7hI/ "
2016-10-24,46514479,Portland,"This election matters. Your votes matter. Thank you to all of our supporters, volunteers, and…  https://www.instagram.com/p/BL9ndmxjMry/ "
2016-10-23,24045607,"Portland, OR",Possibly the most important election of their life time. traderjoesfood @ Trader Joe's -…  https://www.instagram.com/p/BL6y-JzDfFf/ 
2016-10-22,25472241,PortlandOR&LosAngeles,This was taken 10/21/16Still think this election is legit? The sparring back and forth between…  https://www.instagram.com/p/BL43VczDAxx/ 
2016-10-20,312301065,"downtownMountainView, CA","With all the election seriousness, I needed a good laugh tonight! #voteforpedro #seriously…  https://www.instagram.com/p/BLztoRMhwVm/ "
2016-10-20,24902154,Everywhere,This election wow!! #vote
2016-10-19,604357314,"Portland, Oregon","In non election news, I tried a new place for lunch today and this bacon tomato bisque and…  https://www.instagram.com/p/BLxIYDrgPAr/ "
2016-10-16,16281489,"Portland, OR","America, pease disregard all the ugliness of this election & realize there are still beautiful…  https://www.instagram.com/p/BLo-2q1hubk/ "
2016-10-15,2228210185,"Portland, OR","""And remember this it's a rigged election""  holy fuck he's conditioning his followers"
2016-10-13,109390837,"SanFrancisco, CA",After checking twitter during this election cycle. @ Great Notion Brewing  https://www.instagram.com/p/BLhgTIhg90F/ 
2016-10-13,757400316060979200,"Portland, Oregon, USA",Trump complains about the TIMING of articles saying it's to bring him down before election.Can't we say the same about Wikileaks/Hillary?
2016-10-12,757400316060979200,"Portland, Oregon, USA","LET THEM THINK THIS,LOL!   ""@bridgebotelho: Do you know when Election Day is? Trump doesn't.  http://www.motherjones.com/politics/2016/10/trump-gets-election-day-wrong … via @MotherJones"""
2016-10-10,21050287,"Shoreline, Washington","@XolaniVespid Just like in an election, you select from those who are interested in the job, even if none of the candidates is ideal."
2016-10-05,2228210185,"Portland, OR","I'm, no Samantha Bee, the first election in Maine that elected a Republican wasn't spoiled by an independent, it was spoiled by a dem."
2016-09-30,38804674,"Molalla, Oregon","America, our problem is not the coming election...our problem is these random sightings of…  https://www.instagram.com/p/BLARUHlDXm_/ "
2016-09-29,520656786,,"With the election looming in the near future, it is time for some words of encouragement from…  https://www.instagram.com/p/BK7_hY2D_JB/ "
2016-09-22,2228210185,"Portland, OR",I motion that we cancel this election and elect @JustinTrudeau as the interim president until we can get our crap together.
2016-09-18,17821846,"Portland, OR",I keep getting complimented on my shirt today. Think it has anything to do with the election?…  https://www.instagram.com/p/BKhPUT-AYdZ/ 
2016-09-13,18533309,"Portland, Oregon","Election year #selfie, pretending the news isn't real. @ Portland, Oregon  https://www.instagram.com/p/BKTS5JWhQmQ/ "
2016-09-11,779299,"Halifax, NovaScotia, Canada",My New Fighting Technique Is Unstoppable/Get Your War On/artisanal pencil sharpener/Going Deep/Election Profit Makers @david_rees talk $$$
2016-08-31,1889086489,"Portland, Oregon.USA",@OregonGovBrown #oregon #equality #bisexual @oregongovbrown thomasmlauderdale #vote #noonhate #election…  https://www.instagram.com/p/BJyjpYlBG5v/ 
2016-08-03,757400316060979200,"Portland, Oregon, USA",@HillaryClinton @timkaine Imagine if Trump has 1000's believe election is rigged?Scary! This is beyond a joke!He needs a psych eval!
2016-08-01,757400316060979200,"Portland, Oregon, USA","Be prepared @HillaryClinton @timkaine The minute you win the election,the Trump cult will be crying fowl and saying you rigged the vote!"
2016-07-24,78833378,"Seattle, WA",The best thing about this election season is all the people who think either of the candidates is better than the other
2016-07-06,171636570,,"@TODAYshow - so disappointed about your biased, Trump-leaning election coverage. I'm now a @GMA viewer."
2016-07-05,4904,"Portland, OR","@Cinemark I'm at Century Clackamas Town Center & XD - @cinemark for The Purge: Election Year in Happy Valley, OR https://www.swarmapp.com/c/eDC0fF49uiz "
2016-07-01,3325825726,+965⇄+356,"@RegalMovies I'm at Regal Cinemas Evergreen Parkway 13 & RPX - @regalmovies for The Purge: Election Year in Hillsboro, OR https://www.swarmapp.com/c/2zD86EiLJus "
2016-06-22,25747362,"Oregon, USA","2016 election. #portlandoregon #election #yardsign @ Portland, Oregon  https://www.instagram.com/p/BG9-lClisXa/ "
2016-06-22,721445500247871488,"Portland, OR",Earth here latelyMass killikng President election
2016-06-17,265077124,PortlandOR,Celebrating Don's election to Prime Minister of the Royal Rosarians 2019!!!! With Jim and Don  freaking awesomeness! https://www.swarmapp.com/c/9h8a3qD3GH3 
2016-05-18,17146112,,Pics from election night party for our next mayor: Ted Wheeler #pdxmayor #electionnight #teamted…  https://www.instagram.com/p/BFjeymYxEf0/ 
2016-05-17,384588196,"Seattle, WA",I'm at the @HillaryClinton party on NE 42nd as election results are announced. #pdx #KOIN6News - pic.twitter.com/kSwt3ff0he
2016-05-17,14364933,"Portland, OR",Biked past my favorite house on Willamette Blvd. to find it all done up for Election Day.…  https://www.instagram.com/p/BFh-4yXsMk9/ 
2016-05-17,12935572,"Seattle, WA",Coffee stand in the newsroom for election night #LiveOnK2 . Must only have two... pic.twitter.com/jeYSpqOlv5
2016-05-17,65589580,"Portland, OR",Have to keep us caffeinated on election night. #vote #vote2016 #liveonk2 @ Katu  https://www.instagram.com/p/BFh6PpOsf7X/ 
2016-05-17,12935572,"Seattle, WA","Election night grub: pasta, salad and coffee from a cart in the newsroom. pic.twitter.com/krbBED0OTi"
2016-05-17,1648510940,"Portland, OR","'Merica. <Emoji: Flag of United States>•••••#America #election #election2016 #ivoted #pdxnow @ Portland, Oregon  https://www.instagram.com/p/BFhsG8MIU3-/ "
2016-05-17,12935572,"Seattle, WA",Now some downtime at @pinest8biscuits with a Reggie Deluxe and lots of coffee. Long election night ahead at work. pic.twitter.com/DL6VSIvmCX
2016-05-16,2230866788,PDX,Election/Primary Day tomorrow in Oregon @ Five Poplars  https://www.instagram.com/p/BFe166PJeTpUsUczGu46A4fc6VpX2tzkMBvVkY0/ …
2016-05-10,24827036,"Portland, Oregon","Wow, this is part of my my election ballot.  See anything odd?  Welcome to the DPRK, I mean…  https://www.instagram.com/p/BFPtFXDj-vJ/ "
2016-05-06,103816706,"Portland, OR",There's been a lot of things weighing on my mind lately. In good ways and bad ways. The election…  https://www.instagram.com/p/BFEyffcgyOs/ 
2016-04-30,15575548,"Portland, OR",Take note other states - this is how you hold an #election. Mail-in…  https://www.instagram.com/p/BE07Q4VJGS0r_uMy0d4qe62TZHHCqp3Pxo6k8A0/ …
2016-04-26,2345891000,3rdPlanetfromtheSun,@CnnIs @CNNis there still an election going on? Haven't heard Wolf say really important update yet I tweet @donnabrazile
