date,user_id,location,tweet
2017-05-02,2279162833,UniversityofWashington,"Fact checker from @IHME_UW ""Changes in health in England, 1990–2013 ...""  as the #election plays out @TheLancet  http://ow.ly/RwtP30bnk7q  pic.twitter.com/81sQdHtbj4"
2017-04-27,21827225,"Arlington, VA","Here’s the thing about “Pence would be worse than Trump“: with Pence, it’s like losing an election. With Trump, it’s like losing our reality"
2017-04-22,74998364,"Seattle, WA","Trying to avoid politics, FBI Director James B. Comey shaped election http://st.news/2oAlAvl "
2017-04-18,74998364,"Seattle, WA",It’s France’s turn to worry about election meddling by Russia  http://toplocalnow.com/us/seattle/at/5 
2017-04-16,84428059,Seattle|Redmond|NYC,If you are in debt to Russians and then work secretly work to rig an election so you can pay them back. Hashtag Treason Matters. https://twitter.com/realDonaldTrump/status/853595628655587334 …
2017-04-14,74998364,"Seattle, WA","Facebook targets 30,000 fake France accounts before election http://toplocalnow.com/us/seattle/at/9 "
2017-03-28,74998364,"Seattle, WA",Clinton jabs Trump in first major post-election speech - http://bit.ly/2nfAtCt 
2017-03-20,74998364,"Seattle, WA",FBI investigating election interference by Russia; no evidence of Trump wiretap by Obama - http://toplocalnow.com/us/seattle/at/noon …
2017-03-18,2856031,"iPhone:47.827711, -122.275144","Best . election . ever ! <Emoji: Ok hand sign><Emoji: Smiling face with smiling eyes> Sleepless in Seattle, and other places: Trump-induced insomnia…  https://www.instagram.com/p/BRxeAoEDP_7/ "
2017-03-16,31928796,"Whistler, BC, Canada",Exciting #lgbtbiz discussion w/ Left Coast Politics in the post election era Sally Clark - uofwa…  https://www.instagram.com/p/BRtfmjajJ0h/ 
2017-03-13,3145641591,"Tacoma, Washington","The Rite of Election was celebrated on March 11, 2017 at St. Charles Borromeo Parish. Every…  https://www.instagram.com/p/BRl7vIBAeR0/ "
2017-03-06,19407682,Seattle,"""What's with the scarf?""""Yearning for better times.""""...Halloween?""""""Before the election."" @…  https://www.instagram.com/p/BRTWaK-g6Tk/ "
2017-03-04,3739591,"Tacoma, WA",@meeker253 I’ve heard that a lot since the election
2017-03-04,74998364,"Seattle, WA",Trump claims Obama had his phones wiretapped during last year's election; no proof was cited  http://st.news/2lIvutw 
2017-03-04,74998364,"Seattle, WA",Trump accuses Obama of wiretapping him before election http://toplocalnow.com/us/seattle/at/6 
2017-03-02,74998364,"Seattle, WA","Amid bipartisan pressure, Jeff Sessions will recuse himself from investigation into Russia, 2016 election…  https://twitter.com/i/web/status/837414857943224324 …"
2017-03-01,74998364,"Seattle, WA",Trump's election has Oprah Winfrey pondering a presidential run http://kiro.tv/2ls39HP 
2017-02-24,74998364,"Seattle, WA",The Washington Post's new motto predates Trump's election  http://trib.al/6eQb19B 
2017-02-20,74998364,"Seattle, WA","16 quit commission for Asian American, Pacific Islanders since Trump's election  http://toplocalnow.com/us/seattle "
2017-02-19,74998364,"Seattle, WA",Graham: Trump must punish Russia for election interference  http://trib.al/VwTxAcc 
2017-02-16,74998364,"Seattle, WA",Ryan Murphy says the next ‘American Horror Story’ will cover the 2016 election  http://toplocalnow.com/us/seattle 
2017-02-08,74998364,"Seattle, WA",“Moving to Canada” was always an election-year empty threat. Nobody ever actually did it. Until now.…  https://twitter.com/i/web/status/829480223171342340 …
2017-02-08,74998364,"Seattle, WA","Moving to Canada is no election-year joke anymore, columnist Danny Westneat writes  http://toplocalnow.com/us/seattle "
2017-02-07,74998364,"Seattle, WA","As Trump fears fraud, GOP votes to kill election commission  http://toplocalnow.com/us/seattle "
2017-02-06,74998364,"Seattle, WA",Seattle gay business owner goes public after targeted in hate crime post-election. Someone left this note on his wi…  https://twitter.com/i/web/status/828707548047904768 …
2017-02-01,74998364,"Seattle, WA","President Trump's Black History Month speech begins with, ""Well, the election, it came out really well""…  https://twitter.com/i/web/status/826934132177526785 …"
2017-01-29,14290242,Seattleborn&bred.,That’s the hope anyway RT @godtributes: IMMIGRATIONS FOR THE IMMIGRATION GOD! MIDTERM ELECTIONS FOR THE MIDTERM ELECTION LORD
2017-01-28,14574672,"Seattle, WA",Been wanting to start @jdickerson's #whistlestop for a while. For when my election fatigue was…  https://www.instagram.com/p/BP1ATSpjnm7/ 
2017-01-28,74998364,"Seattle, WA",3 Russians charged with treason linked to U.S. election hacking  http://st.news/2kd8C8q 
2017-01-25,2856031,"iPhone:47.827711, -122.275144",Dow - since election. <Emoji: Smiling face with smiling eyes> @ CN87UU  https://www.instagram.com/p/BPtfjDGlNJI/ 
2017-01-25,74998364,"Seattle, WA",We crunched the numbers for the Nov. General Election to see how the county’s six biggest cities voted:…  https://twitter.com/i/web/status/824378981965250564 …
2017-01-24,74998364,"Seattle, WA",Secretary of State Wyman proposes Presidential Primary date change to March & other election reforms in requests to…  http://toplocalnow.com/us/seattle 
2017-01-20,74998364,"Seattle, WA","On ""The Overcast"" we talk about the Womxn's March on Seattle and how Trump's election spurred women to activism.…  https://twitter.com/i/web/status/822450865600598021 …"
2017-01-19,74998364,"Seattle, WA","In case you hadn't heard, Edgar Martinez falls short of election to HOF (pic Steven Bisig)  http://kng5.tv/2k5khXp "
2017-01-17,2499195470,"Seattle, WA",Happy birthday to the best candidate for the 2020 United States <Emoji: Flag of United States> Presidential Election –…  https://www.instagram.com/p/BPXvJIaBVo9/ 
2017-01-12,18519541,"Tacoma, WA",He was right about EVERYTHING during the election. A POC and a voice for all the hustle bustle…  https://www.instagram.com/p/BPMQiO4FiBP/ 
2017-01-10,74998364,"Seattle, WA",Planned Parenthood: IUD requests have gone up 900 percent since election  http://trib.al/G3fTiV7 
2017-01-06,74998364,"Seattle, WA","New declassified report: Russian President Vladimir Putin 'ordered' effort to influence U.S. presidential election,…  http://toplocalnow.com/us/seattle "
2017-01-05,74998364,"Seattle, WA","Russia undoubtedly interfered in America's 2016 presidential election, the top U.S. intelligence official said toda…  https://twitter.com/i/web/status/817079099214745601 …"
2017-01-05,82697233,"Kent, WA",Do we hold election debriefs to figure out why people don't vote? Seems like there should be a local and federal program to accomplish this.
2016-12-30,84428059,Seattle|Redmond|NYC,Sounds vaguely familiar to a recent presidential election. Oh Alabama why must you be so red. https://twitter.com/ralphDrussoAP/status/814935039557275648 …
2016-12-29,74998364,"Seattle, WA",Russia should be sanctioned for election hacks say US senators. http://st.news/2ilzdiM 
2016-12-21,267812051,Seattle,I have a strange feelng of foreboding. I think it's more thn post election pre holiday ennui. Anybody else feelng unsettled? #spideysense
2016-12-20,74998364,"Seattle, WA",Sixth graders launch anti-bullying campaign after divisive election season. Natalie Brand shares their story - http://kng5.tv/2h8mgaH 
2016-12-20,916596266,ThePast,"""Election Day 2013: Races to Watch""  http://feedly.com/k/1b2rc6Z "
2016-12-20,74998364,"Seattle, WA","Morning! Congrats to Pearl Jam on election to RockHall2017! Let's just breathe, mind your manners & celebrate with…  https://twitter.com/i/web/status/811229047761973248 …"
2016-12-16,74998364,"Seattle, WA",President Obama urges Trump to take foreign election impact seriously.  http://st.news/2hsXbYN 
2016-12-16,15567438,"Seattle, WA",FBI backs CIA view that Russia intervened to help Trump win election - The Washington Post  https://www.washingtonpost.com/world/national-security/fbi-backs-cia-view-that-russia-intervened-to-help-trump-win-election/2016/12/16/05b42c0e-c3bf-11e6-9a51-cd56ea1c2bb7_story.html …
2016-12-13,2546490403,"Seattle, WA",Russia Hacked out Election. Tell Obama to do the right thing. Take a photo and post your…  https://www.instagram.com/p/BN9-cu1D55B/ 
2016-12-11,619641237,seattle,#ImStillNotOver Obama doing nothing about election fraud in the democratic primary and never will be
2016-12-10,74998364,"Seattle, WA",Obama orders 'full review' of Russian interference with election  http://kng5.tv/2gkB0j9 
2016-12-09,74998364,"Seattle, WA",Report: CIA concludes Moscow sought to help Trump in election - http://bit.ly/2gLcdWr 
2016-12-09,82697233,"Kent, WA",So we're at Russian hackers involved in influencing the election but no clear connection to the Kremlin... great. https://twitter.com/washingtonpost/status/807385364533039104 …
2016-12-09,23803506,,Use this election as call to action. Everyday. Democracy is up to us. Helen Howell @BuildingChanges #yearinreview @philanthropynw
2016-12-04,2251496095,Seattle,A literal sign I'm not the only one terrified since the election. @ Genesee Off Leash Dog Park  https://www.instagram.com/p/BNnQY-zhzY4/ 
2016-12-02,1450400215,Indianapolis,"There are 1,431 days until the next presidential election. I have resolved to post each day…  https://www.instagram.com/p/BNhxLwogjaG/ "
2016-11-29,1522654760,,#election #truth @ Pioneer Square Seattle  https://www.instagram.com/p/BNaHPWUD6AX/ 
2016-11-29,74998364,"Seattle, WA",Civil-rights groups document hundreds of hate incidents since election  http://st.news/2gttR1n 
2016-11-28,20073834,Brazil,Let's talk about social media and election! #fulbrightbrasil #UW…  https://www.instagram.com/p/BNYLYiygRrJV6I-r6NIV4J7aGbOFF3W4WhJEjw0/ …
2016-11-24,108209696,Cascadia,Scanning and processing my post-election art to submit to Resist! A newspaper that will be…  https://www.instagram.com/p/BNNEtPlBTQB/ 
2016-11-23,82697233,"Kent, WA",@mattyglesias Can she do that on behalf of another campaign? It wouldn't affect her chances of election.
2016-11-23,74998364,"Seattle, WA",Dalai Lama: “I have no worries’ about Trump’s election. http://st.news/2gkaasU 
2016-11-21,14290242,Seattleborn&bred.,Pharmacy was out of Prozac today when I went to pick up my Rx. Draw your own conclusions about this post-election world
2016-11-20,23185068,,"Post election, a lot of people have asked me for book…  https://www.instagram.com/p/BNDsp4-jQD-obymQkCayhaRS_yIqtZ3uxFXWdg0/ …"
2016-11-17,709714376,"Oxford, Seattle, SouthAsia","The way I coped w/ the election results. The small print on the back says, ""little mints that…  http://ln.is/www.instagram.com/p/wDhfD …"
2016-11-16,117132510,Seattle,Election Night 2016 About an hour before we realized what was happening.  We went from preparing…  https://www.instagram.com/p/BM4HUnihWD5/ 
2016-11-16,74998364,"Seattle, WA",Trump’s election has Northwest women worried about health care and birth control http://st.news/2feoxhd 
2016-11-15,1410987044,"Seattle, WA",Photos of The Guessing Game from the Election Night Blowout at Slims Last Chance Saloon by Kurt…  https://www.instagram.com/p/BM2-dezhvRn/ 
2016-11-15,14290242,Seattleborn&bred.,"First therapy appt since Election Day was what you would expect from #predictablemaggi and also man, do I feel bad for counselors in general"
2016-11-15,15404811,"Kirkland, WA",LETTER | Election Results   https://www.kirklandviews.com/blog/2016/11/15/letter-election-results … #Kirkland
2016-11-15,21007451,"Kirkland, WA",LETTER | Election Results   https://www.kirklandviews.com/blog/2016/11/15/letter-election-results … #Kirkland
2016-11-14,74998364,"Seattle, WA",Students from at least a dozen Seattle-area schools plan walkouts this afternoon to protest election of Trump:…  https://twitter.com/i/web/status/798245654623649792 …
2016-11-14,74998364,"Seattle, WA",Hundreds of local students plan class walk out Monday in protest of Trump's election --  http://komonews.com/news/local/hundreds-of-local-students-plan-class-walk-out-in-protest-of-trumps-election …
2016-11-14,43846131,"Seattle, WA",This song is pretty apropos after the election y'all. The Unattractive Portable Head=TRUMP <Emoji: Face with tears of joy>.…  https://www.instagram.com/p/BMyd719h1CC/ 
2016-11-13,2477400300,emeraldcity,I found this newspaper lying around today put out after the election and although I'm still…  https://www.instagram.com/p/BMx5Ihzggjo/ 
2016-11-13,74998364,"Seattle, WA",Have you been harassed since the election in Washington state? We want to hear your story. Share it with us:…  https://twitter.com/i/web/status/797832703450218497 …
2016-11-13,3576435014,"Snohomish, WA",Youth service today: What should our response be to the election? Get ready for the…  https://www.instagram.com/p/BMwXO_vDjyl/ 
2016-11-12,16922924,Tacoma/Seattle,A crazy election week & a loss by my beloved Huskies can all melt away w/ a simple stop for a…  https://www.instagram.com/p/BMvQaJRBS_1/ 
2016-11-12,1110335174,"Madison, WI",We would like to thank you for participating in this year's election... Please be patient and…  https://www.instagram.com/p/BMvPBm7gegm/ 
2016-11-12,74998364,"Seattle, WA","If you have been harassed since the Nov. 8 election, we'd like to hear your story  http://st.news/2fHnuHT "
2016-11-12,74998364,"Seattle, WA",Here's why people are wearing safety pins after the presidential election >>  http://bit.ly/2eOrlRl 
2016-11-12,420348128,"SantaCruz, CA","Even despite all the sickness and anger I feel about the results of the election, you're looking…  https://www.instagram.com/p/BMuqSTChOi1/ "
2016-11-12,74998364,"Seattle, WA",Thousands protest in LA streets over Trump's election win >>  http://bit.ly/2eSEJqG 
2016-11-12,26696141,"scottsdale, az",A great start to help my election hangover. Thank you @azpeacemakers @peacemakerjd nickscropos…  https://www.instagram.com/p/BMuPpsylGdx/ 
2016-11-12,87092721,"Seattle, WA",A visit from mom is the perfect post-election cure-all. @ Elysian Bar  https://www.instagram.com/p/BMuOh_lBcoG/ 
2016-11-12,113466949,"Dallas, TX",So we can blame Big Brother for the election since they withheld Clinton votes by locking them in a house for months? https://twitter.com/Sanniel/status/797493704898605056 …
2016-11-12,74998364,"Seattle, WA",Have you been harassed since the election? Share your story on the form at  http://st.news/2eRbDIj 
2016-11-11,48811861,,"Given the recent election and all the racism, hatred, and violence that has come with it, I…  https://www.instagram.com/p/BMsfCMqgfXR/ "
2016-11-11,74998364,"Seattle, WA",Schools across U.S. report racially charged incidents after election  http://st.news/2fXZHHn 
2016-11-11,74998364,"Seattle, WA",Have you been harassed since the election in Washington state? We want to hear your story. Share it with us  http://st.news/2fK0N5Y 
2016-11-11,74998364,"Seattle, WA",Have you been harassed since the election in Washington state? We want to hear your story. Share it with us  http://st.news/2frFo0q 
2016-11-11,52850069,chicago/seattle,"After the #election, that bum press release, and my giving up of all things coffee, I'm ready…  https://www.instagram.com/p/BMrhlUuBz_u/ "
2016-11-11,74998364,"Seattle, WA",Have you been harassed since the election in Washington state? We want to hear your story. Share it with us  http://st.news/2fHHWKW 
2016-11-10,23911397,Seattle,It's 2016. Impossible to rule out anything: (a) electors revolt or (b) credible evidence emerges Russia did hack the election results?
2016-11-10,2499195470,"Seattle, WA",There are some people who will use this election to their advantage...#GoodBoyGoneWorst…  https://www.instagram.com/p/BMpZuHPh47V/ 
2016-11-10,2499195470,"Seattle, WA","In the many social media debates about the Presidential Election 2016, I came across this…  https://www.instagram.com/p/BMpUx3whBVZ/ "
2016-11-10,21215573,"Seattle, WA","""R.I.P. America"" was there on Election Day. Trump was added last night. #design #graffiti…  https://www.instagram.com/p/BMo_rUODrlU/ "
2016-11-10,23684428,"Seattle, WA",Seattle by mono. Election day. @ Seattle Center Monorail  https://www.instagram.com/p/BMo-AVKB1mSLICaSYyd2-PXOzji2srkMr3Soyc0/ …
2016-11-10,23684428,"Seattle, WA","Coffee bound. Post US ELECTION face. @ Northgate, Seattle  https://www.instagram.com/p/BMo8W49hvDVoiW2Wx7vinzvFK_7jjR8Nt0MB000/ …"
2016-11-10,92469483,"Seattle, WA","I have so many opinions about this election, and most of them are not at all positive. This…  https://www.instagram.com/p/BMovT3yBJDz/ "
2016-11-10,23281110,"Seattle, WA",Winning #YesOn1491 with the indomitable Zoe Moore on election night — @ The Westin Seattle  https://www.instagram.com/p/BMomMw6jNKD/ 
2016-11-09,4242831,Seattle,Shadows on election night #usa #election2016 @ Capitol Hill (Seattle)  https://www.instagram.com/p/BMngFkNAEA7/ 
2016-11-09,1895069540,"Seattle, WA","We had at least one major #victory this #election. Our #light in the #dark storm. Ladies,…  https://www.instagram.com/p/BMnYJHvBKa3/ "
2016-11-09,1895069540,"Seattle, WA","We had at least one major #victory this #election. Our #light in the #dark storm. Ladies,…  https://www.instagram.com/p/BMnXwjAhh3u/ "
2016-11-09,1895069540,"Seattle, WA","We had at least one major #victory this #election. Our #light in the #dark storm. Ladies,…  https://www.instagram.com/p/BMnXqj8h__i/ "
2016-11-09,97297959,Seattle,"Its here, the election-free zone. Come be carefree and listen to records with…  https://www.instagram.com/p/BMnS9Q_DcS-/ "
2016-11-09,18859285,Seattle,#Seattle is currently protesting the election of Donald Trump. I've seen atleast a thousand…  https://www.instagram.com/p/BMnKkIkjSA3/ 
2016-11-09,40058877,"Someplacethatyournot, USA",I'm already over this election lol. Time to prepare for kanyewest &…  https://www.instagram.com/p/BMnI9PtBRNWpaS8OAMfG0ti45KcZ-C8MAZzH480/ …
2016-11-09,52729254,"Edmonds, WA",Stella's still not sure what to think of the election results but knows her new moto jacket is…  https://www.instagram.com/p/BMnBABFAqy4/ 
2016-11-09,21735916,Seattle,During Election: <Emoji: Hushed face><Emoji: Hushed face><Emoji: Hushed face> #nothankyou #makeamericavoteagain #petecarrollforpresident <Emoji: Raised fist (medium light skin tone)><Emoji: Flag of United States> @ The…  https://www.instagram.com/p/BMm9VLZBq9v/ 
2016-11-09,389795527,UnitedStates,"The US election is over. No matter what you think of the result, one thing that seems to have…  https://www.instagram.com/p/BMm7tOmAiFZ/ "
2016-11-09,47168507,"Seattle, WA","Day after the election the sub still came out. @ Bellevue, Washington  https://www.instagram.com/p/BMm6LPtBnkh/ "
2016-11-09,161043,"iPhone:46.999268, -122.908112","It ""just so happens"" that our VR system arrived today — the 1st day post election — May we all…  https://www.instagram.com/p/BMm4IF0DseO/ "
2016-11-09,24383612,"Seattle, WA","Yesterday, all these people turned up for an election party hoping to celebrate Hillary's…  https://www.instagram.com/p/BMm39a0Bx-Y/ "
2016-11-09,483380846,"Atlanta, GA",An image from one of last night's election watch parties. #Seattle #OnAssignment #Election2016…  https://www.instagram.com/p/BMm0Rg9FjmK/ 
2016-11-09,2841750698,"Seattle, Washington",Sage against the machine.- Started this during the election last night. Results kept me…  https://www.instagram.com/p/BMmyv8TDfqC/ 
2016-11-09,188228035,"ÜT:34.0904046, -118.3454752",Still shell shocked from the Election? Come laugh it off tonight 7:30pm...I'm performing @parlorlive. #bellevue #sea pic.twitter.com/46uF09vOSf
2016-11-09,74998364,"Seattle, WA",West Seattle High students walk out over election - http://komonews.com/news/local/west-seattle-high-students-walk-out-over-election …
2016-11-09,2800397977,,post election food binge! getting my jerseymikes on! #buffalochickenwrap #chips #drpepper…  https://www.instagram.com/p/BMmgDWYjrKr/ 
2016-11-09,16302909,"Seattle, Washington",It’s been a tough election season. We find solace in art. Join us for a special free day #attheHenry. Open until 4. pic.twitter.com/4zyUNhC5OK
2016-11-09,14949833,"Seattle, WA98115",@Nov_Project_SEA :: @nov_project_sea falling on the day after election say really was a Godsent for me.  <Emoji: Heavy red heart> +…  https://www.instagram.com/p/BMmd-6QjCUR/ 
2016-11-09,74998364,"Seattle, WA",About 200 West Seattle High School students have walked out in post-election protest. Headed south toward The…  http://toplocalnow.com/us/seattle 
2016-11-09,14864352,"SouthColby, WA",Post election: Time to pickup the crochet again. #teamhannie @ South Colby  https://www.instagram.com/p/BMmVf6jAl9C/ 
2016-11-09,46402897,"Seattle, Washington","My mood after election night ... Just kidding, I broke it while washing it.…  https://www.instagram.com/p/BMmShELDEOC/ "
2016-11-09,2499195470,"Seattle, WA","When the outcome of the election got you questioning whom you gone cut off, who gets to stay,…  https://www.instagram.com/p/BMmQiIWB1xh/ "
2016-11-09,12581502,"Olympia, WA", http://pca.st/0o83  Great podcast that attempt to place this election in historical context. @…  https://www.instagram.com/p/BMmGLGmjnsE/ 
2016-11-09,37822221,NotWhereYouAre...,@AndraDayMusic 2016-11-09: #AptlyNamedTour the #Mourning after the #Election. #CheersToTheFall @andradaymusic…  https://www.instagram.com/p/BMmEuMhgtZB/ 
2016-11-09,25609734,"Auburn, WA","Regardless of the election's outcome, I'm still proud to be an #American and grateful to be…  https://www.instagram.com/p/BMlnUNgBvPj/ "
2016-11-09,36615782,"Seattle, WA",#DrowningOurSad and #Dancing our #Fears away #ElectionNight #Election #Gay #Instagay #Instahomo…  https://www.instagram.com/p/BMlZXAMBezv/ 
2016-11-09,1475811,"Shoreline, WA",This election is why we have the Second Amendment.
2016-11-09,948099698,,@SLNTPLNT Celebrated Election Day with @slntplnt tonight. They took me to the…  https://www.instagram.com/p/BMlPpE3A5YSjXcktlVq7tfEsgRz2KLZbFk5l8c0/ …
2016-11-08,2180005088,"Seattle, Washington",Dressed the part for the election. #2016election #election2016 #vote #vote #election…  https://www.instagram.com/p/BMkXYpXjUW_/ 
2016-11-08,1209413425,"Seattle, WA",Happy Election Day - hoping for the best out of everyone - DC :) #travelblog #travelgram…  https://www.instagram.com/p/BMkXXY7gqKe/ 
2016-11-08,14213502,Washington,"In honor of the election, and the first grant I wrote on my own. #grantwriting #election2016 @…  https://www.instagram.com/p/BMkW4tHDryO/ "
2016-11-08,27941425,"Seattle, WA",Election 2016 is finally here!  Six east coast polls are about to close. Can't wait to see…  https://www.instagram.com/p/BMkW4BpjOFQ/ 
2016-11-08,123337518,Montreal,"Seattle traffic on Election Day! @ Greenlake, Seattle, WA  https://www.instagram.com/p/BMkWaZ3Bu8w/ "
2016-11-08,59715410,"Seattle, WA",1. If you drop off a ballot they still give you stickers! 2. This is the perfect election day…  https://www.instagram.com/p/BMkVDF7ht16/ 
2016-11-08,80942400,,"Burt wants this election to be over! #heswithher @ Greenlake, Seattle, WA  https://www.instagram.com/p/BMkRp_VDgaq/ "
2016-11-08,441623202,"Seattle, WA","This is what I drink on Election Day, a great Barbaresco dedicated to a great woman. #barbaresco…  https://www.instagram.com/p/BMkRGCRjzGZ/ "
2016-11-08,126067288,"Seattle, WA",@SweetasMaVi My coworker made the greatest election day cookies #election2016 visit her at @sweetasmavi…  https://www.instagram.com/p/BMkMbfiAxSj/ 
2016-11-08,5091371,"Seattle, WAandPhoenix, AZ",bentley is super fancy for election day! #dogsofamazon @ Amazon Doppler  https://www.instagram.com/p/BMkMjMbhhSg/ 
2016-11-08,519545250,"MyrtleBeach, SCUSA",Election Day. #punklewisgolf #dedicated #golf #punkcrew #roadtothetour2016 #imcoming #punkcrew…  https://www.instagram.com/p/BMkLmiuhacR/ 
2016-11-08,1558959738,"Redmond, WA","Tshirt Tuesday! Come down, get a pint and get a free tshirt. Election Day Special - $15 pitchers…  https://www.instagram.com/p/BMkIqF6DpwI/ "
2016-11-08,110528816,UnitedStates,"When I land, it will be interesting what I will be landing to #election (@ Seattle-Tacoma International Airport )  https://www.swarmapp.com/c/c3BZAuNKACp "
2016-11-08,109201960,"Seattle, WA",(Day 313) 11/8/16: It's Election Day!!!!!! I voted! Did you?<Emoji: Flag of United States><Emoji: Heavy red heart><Emoji: Blue heart> #election2016 #imwithher @…  https://www.instagram.com/p/BMkFQKajT9M/ 
2016-11-08,33331597,"Washington, DC","The election, too much good food and alcohol have given me an upset…  https://www.instagram.com/p/BMkDiYHB9x4J6VYQKaeSQ2w4EaIVMjg_BM1v_80/ …"
2016-11-08,15504874,"NewYork, NY",On my Election Day walk I spied a blue sky heart through the break in the tree tops. I'm sure…  https://www.instagram.com/p/BMkAz9_g04F/ 
2016-11-08,137911635,"(West)Seattle, WA98116","Election-Day Washington style. No lines, no stickers, no senior-cittizen-election-judges, no…  https://www.instagram.com/p/BMj8YIfh5J8/ "
2016-11-08,24824179,seattle,Jackie says make America great again. Join us tonight for election coverage and Jell-O shots in…  https://www.instagram.com/p/BMj1xzHBBI1/ 
2016-11-08,16423423,"Seattle, WA",Absolutely splendid day for a birthday Election Day #morningrun!…  https://www.instagram.com/p/BMj1CMTA8o8FfLTFsdZQ6YKpiPDJ_CZBk4plyo0/ …
2016-11-08,2842621654,"Tacoma, WA",Finally! Election Day is here! #vote #2016 @ The Law Offices of Barbara A. Bowden  https://www.instagram.com/p/BMj0F_KBbk0/ 
2016-11-08,1945321082,Seattle,"Jen's bacon saying, ""I'm with her""...Election Day breaky with my babe @JENNjennLOO…  https://www.instagram.com/p/BMjzx6sgFKj/ "
