date,user_id,location,tweet
2016-11-06,23911397,Seattle,Comey put his reputation above the election. For absolutely nothing.
2016-11-06,538537745,,Election Night! Come to @fredwildlife and watch results on a giant wall projection while…  https://www.instagram.com/p/BMezcIIAye4/ 
2016-11-06,56622061,Seattle/Reno,Election Day is in 2 days. Here's a friendly reminder of what could have control of this country…  https://www.instagram.com/p/BMetNIkg0XQ/ 
2016-11-06,74998364,"Seattle, WA",Final NBC/WSJ poll before Election Day: Clinton holds a four-point lead over Trump Decision2016 http://nbcnews.to/2ecXV3L 
2016-11-05,1906198243,"Seattle, WA",My boss has vowed to wear a pantsuit a day until the election.#considermewowed#Election2016 @…  https://www.instagram.com/p/BMcy9ukg_1A/ 
2016-11-05,3739591,"Tacoma, WA","@DustinDK man, took me a couple reads to figure out what ballot class was. Too much election."
2016-11-04,267812051,Seattle,"Thght u were talkng abt the election! @SickAndHostile:Nausea, cold sweats, tummy trouble, shaky, jst the thght of food makes U green? Chemo!"
2016-11-04,8665662,"Seattle, WA",This has been and most likely will always be the most divisive election of my lifetime. That…  https://www.instagram.com/p/BMaUwfuAUWG/ 
2016-11-03,31343896,"Seattle, WA",...for Hillary Clinton #proudly#ivoted<Emoji: Flag of United States> #hillaryclinton #election #dumptrump @ West…  https://www.instagram.com/p/BMXbHsqguLk/ 
2016-11-03,457629222,"Tacoma, WA",Get out and vote if you haven't already! This whole election has left us with a bitter taste in…  https://www.instagram.com/p/BMXMfbQhnhy/ 
2016-11-03,18519541,"Tacoma, WA",ELECTION UPDATE: I thought these reminders from auditor to Pierce County voters we're weirdly…  https://www.instagram.com/p/BMW7ZUYl6F1/ 
2016-11-03,113466949,"Dallas, TX","Seeing as #Brexit has been a test of a @realDonaldTrump election, does that mean we could #UnTrump should the worse happen as well?"
2016-11-02,31343896,"Seattle, WA",I proudly voted for Hillary Clinton. .#election #potus #hillaryclinton #barackobama #vote…  https://www.instagram.com/p/BMU1IX3gpvn/ 
2016-11-01,2267659459,GypsyTent,With Election day just around the corner...we have decided to #VoteforPedro <Emoji: Left pointing backhand index (medium skin tone)> @ MISHA  https://www.instagram.com/p/BMR79AbjcWc/ 
2016-11-01,74998364,"Seattle, WA",One week until election day. Have you filled out and mailed in your ballot? Get to it soon and remember to…  http://toplocalnow.com/us/seattle 
2016-11-01,267812051,Seattle,"During a presidential election, too!  @ESchattner: @double_whammied yes - and on the front page! @ReadEatWriteRun @nytimeswell"
2016-10-31,74998364,"Seattle, WA","Election 2016 shattering registration, voter turnout records in Wash. State -  http://bit.ly/2etqcPM "
2016-10-31,470793254,"Seattle, WA",So excited to be dropping off my ballot today *WITH* my son's ballot as well. His first election…  https://www.instagram.com/p/BMPn6qoF0jC/ 
2016-10-31,74998364,"Seattle, WA",AVOID A NOV. SURPRISE: Today 10/31 last day to register to vote in WA. Main election offices in King Pierce…  http://toplocalnow.com/us/seattle 
2016-10-31,74998364,"Seattle, WA",Reminder- today (Oct. 31) is the LAST day to register to vote in Washington for this year's election. And you'll ha…  https://twitter.com/i/web/status/793181279399342080 …
2016-10-30,19175335,Seattle&airportseverywhere,"His & hers. #vote #election #WA #Nov8 @ Matthews Beach, Seattle  https://www.instagram.com/p/BMNgMazgKOr/ "
2016-10-29,327344464,"Oregon, USA","<Emoji: Flag of United States> BALLOTS IN!! <Emoji: Grinning face with smiling eyes><Emoji: Grinning face with smiling eyes><Emoji: Victory hand (medium light skin tone)><Emoji: Person raising both hands in celebration (medium light skin tone)><Emoji: Raised hand with part between middle and ring fingers (medium light skin tone)><Emoji: Flag of United States>Had to snap a pic for this historical #election!! Yes, it takes time,…  https://www.instagram.com/p/BMLK0Tzj9Tf/ "
2016-10-29,2199057062,,"Ballots and Beer, 2016 General Election Edition. @ Pacific Brewing & Malting Co.  https://www.instagram.com/p/BMKhE59Dm2I/ "
2016-10-29,74998364,"Seattle, WA","Your guide to Nov. 8 election ballot -- from presidential race, to governor, to the least-understood initiatives:…  https://twitter.com/i/web/status/792357580152705028 …"
2016-10-28,113466949,"Dallas, TX",Didn't I tweet about how the only way @realDonaldTrump could know the election was rigged was if he rigged it?? <Emoji: Face with tears of joy> https://twitter.com/KedronBardwell/status/792116100024586240 …
2016-10-27,19806157,"Berkeley, CA","Seattle, WA #whig #bullmoose #parody>reality #election @ University Book Store  https://www.instagram.com/p/BMFeoBSB4mT/ "
2016-10-27,74998364,"Seattle, WA",Oct. 31 last day to register in person at your county elections office if you want to vote in General Election.  http://bit.ly/2eVUY3p 
2016-10-26,23300291,"Seattle, WA, USA","Election Day Nov.8th #SUPREME @ Seattle, Washington  https://www.instagram.com/p/BMDjKUvBSpT/ "
2016-10-26,562154200,,"So proud of my Mom, she's voting for her first time! #ballot #voting #kcelections #election…  https://www.instagram.com/p/BMDICSrADjK/ "
2016-10-26,74998364,"Seattle, WA",Sheryl Crow starts petition: 'Shorten the U.S. presidential election cycle' >>…  https://twitter.com/i/web/status/791388685744955392 …
2016-10-26,1187220445,"Seattle, WA, USA",Weirdest twist of the election has got to be Megyn Kelly turning out to be somewhat likeable https://twitter.com/curtishouck/status/791090355248762880 …
2016-10-24,17714703,SEA,General Election 2016   http://www.hansenjr.com/blogs-main/2016/10/24/general-election-2016 …
2016-10-24,74998364,"Seattle, WA","Remember... Ballots for the General Election are due by 8pm on Tuesday, November 8th. vote waelex komonews https://twitter.com/stevetvnews/status/790414781790294017 …"
2016-10-22,51976209,"Seattle, WA98122",Oprah-- damn where have you been this while election season?!!@oprah hillaryclinton…  https://www.instagram.com/p/BL4wxooAm6h/ 
2016-10-21,267812051,Seattle,"@mmatassa Hey buddy, thx for the follow. How's tricks? Enjoying the election season? ; )"
2016-10-21,778278,"Seattle, WA",The time has come for you to lipsync for your LEGACY!!! #vote #election #seattle #ballot…  https://www.instagram.com/p/BL1_cCOAwm1/ 
2016-10-21,74998364,"Seattle, WA",WA Election 2016 ballots arriving in homes across the state. Most counties mailed by Thursday. Need postmark by Nov…  https://twitter.com/i/web/status/789551546228879360 …
2016-10-20,74998364,"Seattle, WA",Today's candidates could learn from the letter Bush left for Clinton after losing 1992 election…  https://twitter.com/i/web/status/789253594730094597 …
2016-10-20,74998364,"Seattle, WA",Ivanka Trump says father will concede election if defeated  http://trib.al/PnpWCJy 
2016-10-19,34513719,"Seattle, WA",The inconvenient truth for liberals tonight: a FOX News anchor was easily the best presidential debate moderator of this election.
2016-10-19,18791769,"Seattle, WA","Melinda May is OVER this election . #cat #catsofinstagram #nastygirl #nevertrump @ West Seattle,…  https://www.instagram.com/p/BLxYx-iBNJQ/ "
2016-10-19,193268082,OR,"Remember the 2012 election when no one even uttered the phrase ""peaceful transfer of power"""
2016-10-19,75247918,"Lakewood, Washington","3 weeks and my vote will be cast, and this election will finally be over. #PresidentialDebate #PresidentialElection"
2016-10-18,16862337,Seattle,Good thing that winner of presidential election is not determined by sum of areas of counties won. http://www.nytimes.com/2016/10/19/upshot/what-this-2012-map-can-tell-us-about-the-2016-election.html?smid=tw-upshotnyt&smtyp=cur&_r=0 …
2016-10-18,14977007,,Up and at 'em early this morning talking travel and voting this election season #votebeforeyougo…  https://www.instagram.com/p/BLtLqdlDzug/ 
2016-10-18,74998364,"Seattle, WA",GOP’s Wyman calls Trump claim of rigged election ‘irresponsible:'  http://st.news/2e0XvvV 
2016-10-17,113466949,"Dallas, TX",Those naughty democrats trying to rig the election for Hillary <Emoji: Face with rolling eyes> https://twitter.com/mciszek/status/788026963382468608 …
2016-10-15,13215812,"Seattle, WA",Sporting my hillaryclinton 2016 button everyday until the election. #MyBody #MyChoice #MyVote @…  https://www.instagram.com/p/BLmFukmAUj6/ 
2016-10-14,74998364,"Seattle, WA","""This election is incredibly painful,"" says Hillary Clinton during fundraising stop in Seattle.…  https://twitter.com/i/web/status/787134156509704192 …"
2016-10-14,14556477,"GigHarbor, WA",If only women voted in the upcoming Presidential election this would be the result. It's...  https://www.swarmapp.com/c/cvA14HTqmV6  pic.twitter.com/UmEKaG4Wbk
2016-10-14,18612179,,It is coming down to the end of this insane election cycle. This one…  https://www.instagram.com/p/BLkWa-CjxuH2V6kPFQfz-MoEkfj3hV0l8Ehbdw0/ …
2016-10-14,74998364,"Seattle, WA","Hillary Clinton to supporters in Seattle tonight: ""This election is incredibly painful"" komonews  http://toplocalnow.com/us/seattle "
2016-10-14,2499195470,"Seattle, WA",I'm not worried about this election...I'm worried about people...What's really going on with…  https://www.instagram.com/p/BLkCyVmB9gA/ 
2016-10-12,14556477,"GigHarbor, WA",How the election would go if only men were voting: a Trump landslide!  https://www.swarmapp.com/c/hgTkQTDGoBV  pic.twitter.com/6WfYVuz4nr
2016-10-09,287847857,818CALILIFE,"#president #election #mixed @ Seattle, Washington  https://www.instagram.com/p/BLXlA5Yj1CB/ "
2016-10-09,55492461,Seattle,A garbage fire of an election calls for flaming booze. (@ Hula Hula - @seattlehulahula)  https://www.swarmapp.com/c/gFgIEvDkp9E  pic.twitter.com/aK2GFrcVQ8
2016-10-08,51976209,"Seattle, WA98122",And this my friends is what this election has come to: even the NYT has given up and stopped…  https://www.instagram.com/p/BLTscmUgHuA/ 
2016-10-05,108209696,Cascadia,Hand letter writing to swing state NC female voters. So nervous about Nov election! #imwithher…  https://www.instagram.com/p/BLMGN4mhaNU/ 
2016-09-26,113466949,"Dallas, TX",It's time you make your supporters back Hillary! It's your people going other ways that'll lose her the election https://twitter.com/BernieSanders/status/780572199023509504 …
2016-09-24,562154200,,Ballot Drop Box outside Uwajimaya Village @kcelections #kcelections #ballot #voting #election @…  https://www.instagram.com/p/BKwSZfXAHHm/ 
2016-09-22,21050287,"Shoreline, Washington","@furkitfox This isn't an election so much as a live action version of ""Idiocracy."""
2016-09-19,519545250,"MyrtleBeach, SCUSA",50 days to election.
2016-09-15,43634001,Bremerton,These posts sum up this election! pic.twitter.com/j3wr5yiaeX
2016-09-15,1977434107,,"This Presidential Election is similar to the 2009-10 TV season. Kind of like ""Law & Order"" vs. ""The Simpsons"".@FallonTonight"
2016-09-12,74998364,"Seattle, WA",Fears of Russian tampering in U.S. election after 2 state websites hacked  http://st.news/2cR3Ewg 
2016-09-10,74998364,"Seattle, WA","Westneat: If a local Trump supporters’ group is any indication, get ready for a wave of rank sexism in the election.  http://st.news/2c7H7vo "
2016-09-02,752203154,"ChapelHill, NC",I've been watching the news all morning and this was the first election coverage I could get…  https://www.instagram.com/p/BJ2yqG7gUE0/ 
2016-09-01,777353864,"Seattle, WA","Cool upcoming project: Ernie Lou and Tod Steward, who met here years ago, say this election has…  https://www.instagram.com/p/BJ1pEshDUB9/ "
2016-08-24,16272103,"Melbourne, Victoria",Pretty much #Seattle's thoughts on the #American #Presidential #Election — if Seattle were an…  https://www.instagram.com/p/BJgiv47D2uZ/ 
2016-08-02,16342328,pacificNW,In case the election hilarity/terror has distracted you from the public health epidemic of gun killings: https://twitter.com/TheScottCharles/status/760635498457161729 …
2016-08-02,776920693,,"Election time! Get out and vote! (@ King County Elections HQ in Renton, WA w/ @sera7phim)  https://www.swarmapp.com/c/eeQ3XLT6tbg "
2016-08-01,27158975,"LosAngeles, CA",#election @ SEA - Seattle-Tacoma International Airport  https://www.instagram.com/p/BIkys4pheyXOaagua7UUwPOtjwW8KpEWzv3wG00/ …
2016-07-28,16188892,"Seattle, WA","My first election ballot in Washington state. Done! #vote @ Seattle, Washington  https://www.instagram.com/p/BIZwDWeBtNb/ "
2016-07-27,74998364,"Seattle, WA","Obama: ""I think it's fair to say this is not your typical election."" Watch DNC live stream http://st.news/2abgbVp "
2016-07-26,49411679,"iPhone:47.098099, -122.647797",@POTUS @FLOTUS Since election insists on mirroring bad #HouseOfCards fanfic can we at least get a surprise #MichelleObama nom? @flotus <Emoji: Rightwards arrow> @potus
2016-07-25,74998364,"Seattle, WA","Bernie Sanders: ""This election is about the needs of the American people.”LIVE from DNC  http://kiro.tv/NationalConventions …"
2016-07-25,15048191,"47.616093, -122.336023",If the democrats lose this election it will be the #BernieOrBust #berniebros fault. Unbelievable.
2016-07-25,265752616,"Seattle, WA",So much for @HillaryClinton being more likely to win the general election rather than @BernieSanders… https://twitter.com/CNN/status/757520019882405888 …
2016-07-24,270324596,"Serpong, Banten",@5thAveTheatre <Emoji: Face with stuck-out tongue and tightly-closed eyes><Emoji: Face with stuck-out tongue and tightly-closed eyes><Emoji: Face with stuck-out tongue and tightly-closed eyes> ★ The Purge: Election Year (at @5thavetheatre) —  https://path.com/p/2ZcHRH 
2016-07-09,250310389,,"@AMCTheatres I'm at AMC Kitsap 8 - @amctheatres for The Purge: Election Year in Silverdale, WA  https://www.swarmapp.com/c/kalGQoPAZ2Z "
2016-06-24,113466949,"Dallas, TX",With Cameron stepping down does this mean another general election or will another Tory just step into it with no public vote?
2016-06-22,619641237,seattle,@FeelTheBern11 @PresSanders1 it's an election year gimme a break! They all need to go! Bunch of money grubbing assholes #OurRevolution
2016-06-21,416490624,"Biloxi, Mississippi, USA","...to regroup and defeat #Hillary in the general election. If he can do that at all, he can do it without #Bernie's help."
2016-06-16,37381980,WA(PierceCounty)viaDaBX,"Congratulations Mr Brandon Davis, now let's go take this election. #UniteBlue"
2016-06-11,4511751,"SeattleandValpo, IN",Found my election season shirt.  #livedeliciously @ Georgetown Carnival  https://www.instagram.com/p/BGiG0_-SC1V/ 
2016-06-11,30810774,Seattle,Just in time for election year social media commenting! #shakespeare #insults @ Magic Mouse Toys  https://www.instagram.com/p/BGhePxtHntr/ 
2016-06-06,416490624,"Biloxi, Mississippi, USA",The two-party system is the rotten fruit of a poisoned tree—the winner-take-all voting system used in the general election.
2016-06-06,416490624,"Biloxi, Mississippi, USA",The primary process in many ways resembles a series of polls more than it resembles a general election.
2016-06-04,416490624,"Biloxi, Mississippi, USA","Check out ""Unseated members of the United States Congress"" on Wikipedia. Crime and election fraud have disqualified elected members."
2016-06-01,223667037,"Seattle, WA","Talking election 2016 with Steve Schmidt, campaign manager for John McCain's 2008 bid. So far,…  https://www.instagram.com/p/BGHhRB8kngG/ "
2016-05-30,878241524,"Tacoma, Washington",How Floating Might Help You This Election Year  http://dlvr.it/LRNqVj  #FlotationTherapy #floatationtherapy pic.twitter.com/cxdxi7ftDS
2016-05-23,265752616,"Seattle, WA",So many similarities this election year to that of 1964. #AllTheWay
2016-05-13,74998364,"Seattle, WA",Obama: Election Day should be a holiday http://kng5.tv/1slteME 
2016-05-08,74998364,"Seattle, WA",Trump will testify after election on lawsuit http://kng5.tv/1TNO4g0 
2016-05-04,2964621818,,"Sam: ""you know, hitler was in an election, and  trump is in an election... There's no coincidence there"""
2016-05-03,14195930,"Seattle, WA",Trump/Clinton is the Kobayashi Maru election.
2016-05-02,416490624,"Biloxi, Mississippi, USA",I'm seeing claims that #Bernie could defeat Clinton AND Trump in a 3-way general election. I would like to believe this but I'm skeptical.
2016-05-02,74998364,"Seattle, WA",Councilmember Sawant got huge election support from Sonicsgate & other SeattleArena backers.Now she's voting no.  http://toplocalnow.com/united-states/washington/seattle …
2016-04-21,15877456,Seattle,"The US election, in door form @ Seattle, Washington  https://www.instagram.com/p/BEdsNm7R_gp/ "
2016-04-14,416490624,"Biloxi, Mississippi, USA","I've advocated for #Bernie and against #Trump. But if neither is on the ballot in the general election, I'm likely to vote for @DrJillStein."
2016-04-13,74998364,"Seattle, WA",Not registered in WA & want to vote in April Election? April 18 last day to register at yr county elections office  http://1.usa.gov/162XmQJ 
